English_Translation,Italian_Term,Italian_IPA,English_Sentence,Italian_Sentence,Italian_Sentence_IPA,CEFR_Level,Taxonomy,Tags,Notes
tram,tram,/tram/,"As she might not go on the electric tram, she went to Alinari’s shop.","Non potendo salire sul tram elettrico, andò al negozio di Alinari.","/non potɛndo salire sʊl tram elɛtːriko, andɔ al neɡɔtsio dɪ alinarɪ./",A2,Shopping,"A2,Shopping",
transport,trasporto,/traspɔrto/,Transport him would be better!,Trasportarlo sarebbe meglio!,/trasportarlo sarɛbːe mɛʎo!/,A2,Shopping,"A2,Shopping",
treasure,tesoro,/tezɔro/,"What those treasures were, Mrs.","Quali fossero questi tesori, Mrs.","/kwalɪ fɔssero kwestɪ tezorɪ, ɛmmeɛrɾeɛsse./",A2,Shopping,"A2,Shopping",
van,furgone,/fʊrɡone/,The vanes are made of brass.,Le palette sono in ottone.,/le paletːe sono in otːone./,A2,Shopping,"A2,Shopping",
violin,violino,/vjolino/,Some were allowed to have a violin or a clavecin.,Alcuni potevano avere un violino o un clavecin.,/alkʊnɪ potevano avere ʊn vjolino o ʊn klavetʃin./,A2,Shopping,"A2,Shopping",
wallet,portafoglio,/portafɔʎo/,He took out his wallet with trembling fingers.,Tirò fuori il portafoglio con dita tremanti.,/tiɾɔ fʊorɪ il portafɔʎo kon dita tremantɪ./,A2,Shopping,"A2,Shopping",
washing,lavaggio,/lavadʒːo/,You were best meddle with buck-washing!,Era meglio se ti immischiavi con il lavaggio dei soldi!,/ɛra mɛʎo se tɪ immiskjavɪ kon il lavadʒːo deɪ sɔldɪ!/,A2,Shopping,"A2,Shopping",
washing,lavaggio,/lavadʒːo/,You were best meddle with buck-washing!,Era meglio se ti immischiavi con il lavaggio dei soldi!,/ɛra mɛʎo se tɪ immiskjavɪ kon il lavadʒːo deɪ sɔldɪ!/,A2,Shopping,"A2,Shopping",
wealth,ricchezza,/rikːetsːa/,How do you earn wealth?,Come si guadagna la ricchezza?,/kome sɪ ɡwadaɲɲa la rikːetsːa?/,A2,Shopping,"A2,Shopping",
wheelchair,Sedia a rotelle,/sɛdia a rotɛlle/,Would you ride your wheelchair down the highway?,Andreste in autostrada con la vostra sedia a rotelle?,/andrɛste in aʊtostrada kon la vɔstra sɛdia a rotɛlle?/,A2,Shopping,"A2,Shopping",
wool,lana,/lana/,"For a minute, perhaps, my mind was wool-gathering.","Per un attimo, forse, la mia mente si è messa a fare i conti con la lana.","/per ʊn atːimo, forse, la mia mente sɪ e messa a fare i kontɪ kon la lana./",A2,Shopping,"A2,Shopping",
