English_Translation,Italian_Term,Italian_IPA,English_Sentence,Italian_Sentence,Italian_Sentence_IPA,CEFR_Level,Taxonomy,Tags,Notes
recycle,riciclare,/ritʃiklare/,"The 3 Rs are Reduce, Reuse and Recycle.","Le 3 R sono Ridurre, Riutilizzare e Riciclare.","/le tre ɛrɾe sono ridurɾe, riʊtilidzːare e ritʃiklare./",A2,Food,"A2,Food",
reduce,ridurre,/ridurɾe/,Does he think to reduce me by long absence?,Pensa forse di ridurmi con una lunga assenza?,/pɛnsa forse dɪ ridurmɪ kon ʊna luŋɡa assɛntsa?/,A2,Professional,"A2,Professional",
refer,riferimento,/riferimento/,To whom do you refer?,A chi si riferisce?,/a kɪ sɪ riferiʃe?/,A2,Travel,"A2,Travel",
reflect,riflettere,/rifletːere/,"You are to reflect, Mr.","Lei deve riflettere, signor","/lɛi dɛve rifletːere, siɲor/",A2,Social,"A2,Social",
refrigerator,frigorifero,/friɡorifero/,It is then cooled and placed in the refrigerator.,Viene quindi raffreddato e posto in frigorifero.,/vjɛne kwindɪ raffredːato e posto in friɡorifero./,A2,Shopping,"A2,Shopping",
refuse,Rifiuto,/rifjuto/,I could not possibly refuse.,Non potevo rifiutare.,/non potɛvo rifjʊtare./,A2,Professional,"A2,Professional",
region,regione,/redʒone/,In what region are we wandering?,In quale regione stiamo vagando?,/in kwale redʒone stjamo vaɡando?/,A2,Time & Quantity,"A2,Time & Quantity",
regret,rammarico,/rammariko/,"I shall never regret, ’ said Mr.","Non me ne pentirò mai"", ha detto Mr.","/non me ne pentiɾɔ maj"", a detːo ɛmmeɛrɾe./",A2,Emotions,"A2,Emotions",
regular,regolare,/reɡolare/,The regular chummage is two-and-six.,Il chummage regolare è di due e sei.,/il tʃʊmmadʒe reɡolare e dɪ due e sɛi./,A2,Social,"A2,Social",
regularly,regolarmente,/reɡolarmente/,You have regularly given me up.,Mi avete regolarmente abbandonato.,/mɪ avete reɡolarmente abːandonato./,A2,Grammar,"A2,Grammar",
relationship,relazione,/relatsione/,Sexual misconduct” is the betrayal of trust in a sexual relationship.,"La ""cattiva condotta sessuale"" è il tradimento della fiducia in una relazione sessuale.","/la ""katːiva kondotːa sessʊale"" e il tradimento della fidutʃa in ʊna relatsione sessʊale./",A2,Social,"A2,Social",
relaxed,rilassato,/rilassato/,Prosperity had relaxed the nerves of discipline.,La prosperità aveva rilassato i nervi della disciplina.,/la prosperita aveva rilassato i nɛrvɪ della diʃiplina./,A2,Grammar,"A2,Grammar",
release,rilascio,/rilaʃo/,I do; and I release you.,Lo faccio e ti libero.,/lo fatʃːo e tɪ libero./,A2,Social,"A2,Social",
remain,rimanere,/rimanɛre/,"Do you remain here, Sir?","Rimane qui, signore?","/rimane kwi, siɲore?/",A2,Food,"A2,Food",
remind,ricordare,/rikordare/,I may remind English readers that {Greek} (i.e.,Vorrei ricordare ai lettori inglesi che il {greco} (cioè il,/vorɾɛi rikordare aj letːorɪ iŋɡlezɪ ke iːl {ɡrɛko} (tʃoɛ iːl/,A2,Social,"A2,Social",
remote,remoto,/remɔto/,But that is a remote dream.,Ma questo è un sogno remoto.,/ma kwesto ɛ ʊn soɲɲo remɔto./,A2,Grammar,"A2,Grammar",
remove,rimuovere,/rimʊɔvere/,We did not remove the comma.,Non abbiamo rimosso la virgola.,/non abːjamo rimɔsso la virɡola./,A2,Professional,"A2,Professional",
rent,affitto,/affitːo/,"He was in arrears with his rent, it seems.",Sembra che fosse in arretrato con l'affitto.,/sembra ke fosse in arɾetrato kon laffitːo./,A2,Shopping,"A2,Shopping",
repair,riparazione,/ripaɾatsione/,They repair what is decayed and damaged.,Riparano ciò che è decaduto e danneggiato.,/ripaɾano tʃɔ ke e dekaduto e dannedʒːato./,A2,Professional,"A2,Professional",
replace,sostituire,/sostitʊire/,"Now this substance was wanting on board, and nothing could replace it.",Ora questa sostanza mancava a bordo e nulla poteva sostituirla.,/ora kwesta sostantsa mankava a bɔrdo e nulla potɛva sostitʊirla./,A2,Professional,"A2,Professional",
reply,risposta,/risposta/,"All right, ’ was the reply.","Va bene"", fu la risposta.","/va bɛne"", fʊ la risposta./",A2,Social,"A2,Social",
represent,rappresentare,/rapːrezentare/,"They don’t represent themselves as being among superiors, inferiors, or equals.","Non si rappresentano come superiori, inferiori o uguali.","/non sɪ rapːrezɛntano kome sʊperiorɪ, inferiorɪ o ʊɡwalɪ./",A2,Food,"A2,Food",
request,richiesta,/rikjɛsta/,Let the request be fifty talents.,Che la richiesta sia di cinquanta talenti.,/ke la rikjɛsta sia dɪ tʃinkwanta talɛntɪ./,A2,Social,"A2,Social",
research,ricerca,/ritʃerka/,See the elaborate researches of M.,Si vedano le elaborate ricerche di M.,/sɪ vedano le elaborate ritʃɛrke dɪ ɛmme./,A2,Grammar,"A2,Grammar",
researcher,ricercatore,/ritʃerkatore/,Researchers have identified her with the now-residual Ghaggar-Hakra system in north-west India and Pakistan or the Helmand River in Afghanistan.,I ricercatori l'hanno identificata con l'ormai residuo sistema Ghaggar-Hakra nel nord-ovest dell'India e del Pakistan o con il fiume Helmand in Afghanistan.,/i ritʃerkatorɪ lanno identifikata kon lormaɪ rezidʊo sistɛma ɡaɡːarhakra nel nɔrdɔvest dellindia e del pakistan o kon il fjume ɛlmand in afɡanistan./,A2,Social,"A2,Social",
respond,rispondere,/rispondere/,But they did not respond.,Ma non hanno risposto.,/ma non anno risposto./,A2,Social,"A2,Social",
response,risposta,/risposta/,A fierce cheer was their response.,La risposta è stata un'acclamazione feroce.,/la risposta e stata ʊnakːlamatsione ferotʃe./,A2,Social,"A2,Social",
rest,riposo,/ripɔzo/,You may read the rest.,Potete leggere il resto.,/potete lɛdʒːere il rɛsto./,A2,Social,"A2,Social",
retire,ritirarsi,/ritirarsɪ/,Will you allow me to retire?,Mi permetterà di andare in pensione?,/mɪ permetːeɾa dɪ andare in pensjone?/,A2,Professional,"A2,Professional",
retired,in pensione,/in pensjone/,It is a retired situation.,È una situazione di pensionamento.,/e ʊna sitʊatsione dɪ pensjonamento./,A2,Grammar,"A2,Grammar",
reunion,riunione,/riʊnjone/,Tom came back to Australia for a class reunion.,Tom è tornato in Australia per una riunione di classe.,/tɔm e tornato in aʊstralia per ʊna riʊnjone dɪ klasse./,A2,Professional,"A2,Professional",
reveal,rivelare,/rivelare/,To reveal it would be suicidal.,Rivelarlo sarebbe un suicidio.,/rivelarlo sarɛbːe ʊn sʊitʃidio./,A2,Social,"A2,Social",
rhythm,ritmo,/ritmo/,What do circadian rhythms consist of?,In cosa consistono i ritmi circadiani?,/in kɔza konsistono i ritmɪ tʃirkadjanɪ?/,A2,Social,"A2,Social",
right-hand,destra,/dɛstra/,"Ignore the left, and take the right-hand path.",Ignorate la sinistra e prendete il sentiero di destra.,/iɲorate la sinistra e prendete il sentiɛro dɪ dɛstra./,A2,Grammar,"A2,Grammar",
rise,aumento,/aʊmento/,This gives rise to relishing.,Questo dà origine al piacere.,/kwesto da oridʒine al pjatʃere./,A2,Professional,"A2,Professional",
roast,arrosto,/arɾɔsto/,Has it roasted: she gets someone else to roast it.,Lo fa arrostire: lo fa arrostire da qualcun altro.,/lo fa arɾostire: lo fa arɾostire da kwalkʊn altro./,A2,Food,"A2,Food",
rob,robot,/robɔt/,The robes were badly sewn.,Le vesti erano cucite male.,/le vɛstɪ ɛrano kʊtʃite male./,A2,Food,"A2,Food",
robbery,rapina,/rapina/,Did your client commit the robbery?,Il suo cliente ha commesso la rapina?,/il sʊo kliɛnte a kommesso la rapina?/,A2,Activities,"A2,Activities",
robin,pettirosso,/petːirosso/,"I warrant.—What, Robin, I say!","Garantisco... Cosa, Robin, dico io!","/ɡaɾantisko... kɔza, robin, diko io!/",A2,Home,"A2,Home",
rock,roccia,/rɔtʃːa/,What are men to rocks and mountains?,Cosa sono gli uomini per le rocce e le montagne?,/kɔza sono ʎɪ wɔminɪ per le rɔtʃːe e le montaɲɲe?/,A2,Social,"A2,Social",
roll,rotolo,/rɔtolo/,Then the roll-call was resumed.,Poi è stato ripreso l'appello.,/pɔi e stato riprezo lapːɛllo./,A2,Social,"A2,Social",
romance,romanticismo,/romantitʃizmo/,Here is one of your favorite romances.,Ecco una delle vostre storie d'amore preferite.,/ɛkːo ʊna delle vɔstre stɔrie damore preferite./,A2,Social,"A2,Social",
romantic,romantico,/romantiko/,"It was romantic, unbusinesslike, foolish.","È stato romantico, poco commerciale, sciocco.","/e stato romantiko, pɔko kommertʃale, ʃɔkːo./",A2,Social,"A2,Social",
roof,tetto,/tetːo/,"The roof peak, rafters, and walls are unprotected.","Il picco del tetto, le travi e le pareti non sono protette.","/il pikːo del tetːo, le travɪ e le paretɪ non sono protɛtːe./",A2,Social,"A2,Social",
root,radice,/raditʃe/,What are the thirty-three roots?,Quali sono le trentatré radici?,/kwalɪ sono le trentatre raditʃɪ?/,A2,Social,"A2,Social",
rope,corda,/kɔrda/,See the old villain bound with ropes.,Vedere il vecchio cattivo legato con le corde.,/vedere il vɛkːio katːivo leɡato kon le kɔrde./,A2,Shopping,"A2,Shopping",
roughly,approssimativamente,/apːrossimativamente/,The counterscarp was roughly finished.,La controscarpa è stata completata in modo approssimativo.,/la kontroskarpa e stata kompletata in mɔdo apːrossimativo./,A2,Grammar,"A2,Grammar",
round,rotondo,/rotondo/,That went round the letters.,Questo ha fatto il giro delle lettere.,/kwesto a fatːo il dʒiro delle lɛtːere./,A2,Social,"A2,Social",
roundabout,rotatoria,/rotatɔria/,The story goes in a roundabout way.,La storia si svolge in modo circolare.,/la stɔria sɪ zvoldʒe in mɔdo tʃirkolare./,A2,Grammar,"A2,Grammar",
route,percorso,/perkorso/,"Rouse yourself, then, have courage and continue your route.","Alzatevi, allora, abbiate coraggio e continuate il vostro percorso.","/altsatevɪ, allora, abːjate koradʒːo e kontinʊate il vɔstro perkorso./",A2,Shopping,"A2,Shopping",
royal,reale,/reale/,When is the royal day?,Quando è il giorno reale?,/kwando e il dʒorno reale?/,A2,Grammar,"A2,Grammar",
rubbish,spazzatura,/spatsːatura/,My candid opinion was that it was all rubbish!,La mia opinione più schietta era che si trattava di spazzatura!,/la mia opinjone pjʊ skjetːa ɛra ke sɪ tratːava dɪ spatsːatura!/,A2,Social,"A2,Social",
rugby,rugby,/raɡbɪ/,"Rugby, come to the court with me.","Rugby, vieni in tribunale con me.","/raɡbɪ, vjɛnɪ in tribʊnale kon me./",A2,Activities,"A2,Activities",
ruin,rovina,/rovina/,They will ruin your happiness.,Rovineranno la vostra felicità.,/rovineranno la vɔstra felitʃita./,A2,Shopping,"A2,Shopping",
rumor,voce,/votʃe/,"That rumor has vanished, sir.","Quella voce è svanita, signore.","/kwella votʃe e zvanita, siɲore./",A2,Social,"A2,Social",
runner,corridore,/korɾidore/,Naoko is a fast runner.,Naoko è un corridore veloce.,/naoko e ʊn korɾidore velotʃe./,A2,Social,"A2,Social",
running,corsa,/korsa/,How long has it been running?,Da quanto tempo è in funzione?,/da kwanto tɛmpo e in fʊntsione?/,A2,Food,"A2,Food",
rush,corsa,/korsa/,We will rush on them.,Ci precipiteremo su di loro.,/tʃɪ pretʃipiterɛmo sʊ dɪ lɔro./,A2,Social,"A2,Social",
sadly,tristemente,/tristemente/,"This, ” observed Clifford sadly, “is serious.","Questo"", osservò Clifford con tristezza, ""è grave.","/kwesto"", osservɔ klifford kon tristetsːa, ""e ɡrave./",A2,Grammar,"A2,Grammar",
safe,sicuro,/sikuro/,And Mary King is safe!,E Mary King è salva!,/e mɛːɾɪ kiŋɡ e salva!/,A2,Grammar,"A2,Grammar",
sail,vela,/vela/,"Will you hoist sail, sir?","Vuole issare le vele, signore?","/vʊɔle issare le vele, siɲore?/",A2,Shopping,"A2,Shopping",
sailing,vela,/vela/,We are walking—we are sailing—blindly.,"Stiamo camminando, stiamo navigando alla cieca.","/stjamo kamminando, stjamo naviɡando alla tʃɛka./",A2,Travel,"A2,Travel",
sake,sake,/sake/,For Heaven’s sake be careful!,"Per l'amor del cielo, fate attenzione!","/per lamor del tʃɛlo, fate atːentsione!/",A2,Food,"A2,Food",
salary,stipendio,/stipendio/,"And for salary, ’ said Mr.","E per lo stipendio"", ha detto Mr.","/e per lo stipendio"", a detːo ɛmmeɛrɾe./",A2,Shopping,"A2,Shopping",
sample,campione,/kampjone/,Sample should be carefully taken and well mixed.,Il campione deve essere prelevato con cura e ben mescolato.,/il kampjone dɛve ɛssere prelevato kon kura e bɛn meskolato./,A2,Food,"A2,Food",
sandy,sabbioso,/sabːjozo/,The sandy bottom was clean and bright.,Il fondo sabbioso era pulito e luminoso.,/il fondo sabːjozo ɛra pʊlito e lʊminozo./,A2,Grammar,"A2,Grammar",
satisfy,soddisfare,/sodːisfare/,And I must satisfy them.,E io devo soddisfarli.,/e io dɛvo sodːisfarlɪ./,A2,Food,"A2,Food",
sauce,salsa,/salsa/,"Come, there is sauce for it.","Vieni, c'è una salsa per questo.","/vjɛnɪ, tʃe ʊna salsa per kwesto./",A2,Food,"A2,Food",
sausage,salsiccia,/salsitʃːa/,"That sausage you toasted was his, and he was in all respects a first-rater.","La salsiccia che avete abbrustolito era sua, ed era in tutto e per tutto un fuoriclasse.","/la salsitʃːa ke avete abːrʊstolito ɛra sua, ed ɛra in tutːo e per tutːo ʊn fʊoriklasse./",A2,Food,"A2,Food",
scale,scala,/skala/,A feather will turn the scale.,Una piuma farà girare la bilancia.,/ʊna pjuma faɾa dʒirare la bilantʃa./,A2,Social,"A2,Social",
scared,spaventato,/spaventato/,"My souls, but I was scared!","Le mie anime, ma avevo paura!","/le mie anime, ma avevo paʊra!/",A2,Grammar,"A2,Grammar",
scarf,sciarpa,/ʃarpa/,A scarf was particularly noticed.,"In particolare, è stata notata una sciarpa.","/in partikolare, e stata notata ʊna ʃarpa./",A2,Shopping,"A2,Shopping",
scary,spaventoso,/spaventozo/,The waves were huge and scary.,Le onde erano enormi e spaventose.,/le onde ɛrano enormɪ e spaventoze./,A2,Grammar,"A2,Grammar",
scene,scena,/ʃɛna/,It is a scene terrifically desolate.,È una scena terribilmente desolata.,/e ʊna ʃɛna terɾibilmente dezolata./,A2,Social,"A2,Social",
scenery,scenario,/ʃenario/,We will go to see the scenery.,Andremo a vedere il paesaggio.,/andrɛmo a vedere il paezadʒːo./,A2,Shopping,"A2,Shopping",
schedule,programma,/proɡramma/,"The schedule, sir, ’ said Pell, guessing at Mr.","Il programma, signore"", ha detto Pell, indovinando il signor ""Il programma"".","/il proɡramma, siɲore"", a detːo pɛl, indovinando il siɲor ""il proɡramma""./",A2,Social,"A2,Social",
schoolchild,scolaro,/skolaro/,We talked about the schoolchild last night.,Ieri sera abbiamo parlato dello scolaro.,/jɛrɪ sera abːjamo parlato dello skolaro./,A2,Social,"A2,Social",
schoolwork,compiti scolastici,/kompitɪ skolastitʃɪ/,My cousin is so steeped in schoolwork that his friends call him bookworm.,Mio cugino è talmente immerso nei compiti scolastici che i suoi amici lo chiamano topo di biblioteca.,/mio kʊdʒino e talmente immɛrso nei kompitɪ skolastitʃɪ ke i sʊɔi amitʃɪ lo kjamano tɔpo dɪ bibliotɛka./,A2,Activities,"A2,Activities",
scientific,scientifico,/ʃentifiko/,The scientific gentleman was a bachelor.,Il gentiluomo scientifico era scapolo.,/il dʒentilʊɔmo ʃentifiko ɛra skapolo./,A2,Grammar,"A2,Grammar",
scissors,forbici,/fɔrbitʃɪ/,The action is that of a pair of scissors (Fig.,L'azione è quella di un paio di forbici (Fig.,/latsione e kwella dɪ ʊn paio dɪ fɔrbitʃɪ (fiɡ./,A2,Shopping,"A2,Shopping",
score,punteggio,/pʊntedʒːo/,Two score and twelve were told off.,Due ventidue sono stati espulsi.,/due ventidue sono statɪ espulsɪ./,A2,Social,"A2,Social",
scream,urlare,/ʊrlare/,Here there was a general scream.,Qui ci fu un urlo generale.,/kwi tʃɪ fʊ ʊn urlo dʒenerale./,A2,Social,"A2,Social",
screen,schermo,/skermo/,"The screen still goes, as before.","Lo schermo continua ad andare, come prima.","/lo skermo kontinʊa ad andare, kome prima./",A2,Shopping,"A2,Shopping",
screw,vite,/vite/,"He must be forging the buckle-screw, sir, now.","Starà forgiando la vite della fibbia, signore, ora.","/staɾa fordʒando la vite della fibːia, siɲore, ora./",A2,Social,"A2,Social",
script,sceneggiatura,/ʃenedʒːatura/,"Over time, Pali came to be written in all these scripts.","Nel corso del tempo, il Pali venne scritto in tutte queste scritture.","/nel korso del tɛmpo, il palɪ venne skritːo in tutːe kweste skritːure./",A2,Social,"A2,Social",
seafood,frutti di mare,/frutːɪ dɪ mare/,I want to buy seafood.,Voglio comprare i frutti di mare.,/voʎo komprare i frutːɪ dɪ mare./,A2,Food,"A2,Food",
search,ricerca,/ritʃerka/,These are the three searches.,Queste sono le tre ricerche.,/kweste sono le tre ritʃɛrke./,A2,Grammar,"A2,Grammar",
seaside,mare,/mare/,We used to go on holiday to the seaside.,Andavamo in vacanza al mare.,/andavamo in vakantsa al mare./,A2,Home,"A2,Home",
season,stagione,/stadʒone/,They were handsomer each season.,Ogni stagione erano più belli.,/oɲɲɪ stadʒone ɛrano pjʊ bɛllɪ./,A2,Time & Quantity,"A2,Time & Quantity",
second,secondo,/sekondo/,This is the second summary.,Questa è la seconda sintesi.,/kwesta ɛ la sekonda sintezɪ./,A2,Social,"A2,Social",
secondly,in secondo luogo,/in sekondo lʊɔɡo/,"Now you are to understand, secondly, Mr.","Ora dovete capire, in secondo luogo, che il Sig.","/ora dovete kapire, in sekondo lʊɔɡo, ke il siɡ./",A2,Grammar,"A2,Grammar",
secret,segreto,/seɡreto/,I know the secret now.,Ora conosco il segreto.,/ora konosko il seɡreto./,A2,Social,"A2,Social",
secretary,segretario,/seɡretario/,"You want to be my secretary, do you?","Vuoi essere la mia segretaria, vero?","/vʊɔi ɛssere la mia seɡretaria, vero?/",A2,Social,"A2,Social",
seed,seme,/seme/,Because the seed is bad.,Perché il seme è cattivo.,/perke il seme e katːivo./,A2,Social,"A2,Social",
seek,cercare,/tʃerkare/,Why do you seek me?,Perché mi cercate?,/perke mɪ tʃerkate?/,A2,Professional,"A2,Professional",
seem,sembrare,/sembrare/,It does seem a wonder.,Sembra una meraviglia.,/sembra ʊna meraviʎa./,A2,Food,"A2,Food",
semester,semestre,/semɛstre/,She is working hard this semester.,Sta lavorando sodo in questo semestre.,/sta lavorando sɔdo in kwesto semɛstre./,A2,Time & Quantity,"A2,Time & Quantity",
senior,senior,/sɛnjor/,Where have these senior disciples gone?,Dove sono finiti questi discepoli anziani?,/dove sono finitɪ kwestɪ diʃɛpolɪ antsjanɪ?/,A2,Social,"A2,Social",
sense,senso,/sɛnso/,It is his “five senses”.,"Sono i suoi ""cinque sensi"".","/sono i sʊɔi ""tʃinkwe sɛnsɪ""./",A2,Social,"A2,Social",
separate,separato,/sepaɾato/,"Why did they separate, guardian?","Perché si sono separati, guardiano?","/perke sɪ sono sepaɾatɪ, ɡwardjano?/",A2,Social,"A2,Social",
series,serie,/sɛrie/,The basic series is finished.,La serie di base è terminata.,/la sɛrie dɪ baze e terminata./,A2,Social,"A2,Social",
serious,serio,/sɛrio/,Serious offenses should be known.,I reati gravi devono essere conosciuti.,/i reatɪ ɡravɪ devono ɛssere konoʃutɪ./,A2,Grammar,"A2,Grammar",
seriously,seriamente,/seriamente/,I want to talk very seriously.,Voglio parlare molto seriamente.,/voʎo parlare molto seriamente./,A2,Grammar,"A2,Grammar",
serve,servire,/servire/,Shadow will serve for summer.,Shadow servirà per l'estate.,/ʃadow serviɾa per lestate./,A2,Food,"A2,Food",
service,servizio,/servitsio/,"Do your service, ’ she returned.","Fate il vostro servizio"", rispose lei.","/fate il vɔstro servitsio"", rispoze lɛi./",A2,Social,"A2,Social",
several,diversi,/divɛrsɪ/,We could count several hundreds.,Potremmo contarne diverse centinaia.,/potrɛmmo kontarne divɛrse tʃentinaia./,A2,Grammar,"A2,Grammar",
sew,cucire,/kʊtʃire/,"Why, I did sew it with white!","Perché, l'ho cucito con il bianco!","/perke, lo kʊtʃito kon il bjanko!/",A2,Food,"A2,Food",
shade,ombra,/ombra/,Shade is the obstruction of light.,L'ombra è l'ostruzione della luce.,/lombra e lostrʊtsione della lutʃe./,A2,Social,"A2,Social",
shadow,ombra,/ombra/,Shadow will serve for summer.,Shadow servirà per l'estate.,/ʃadow serviɾa per lestate./,A2,Social,"A2,Social",
shall,deve,/dɛve/,Now--shall I take you in?,Ora... devo portarti dentro?,/ora... dɛvo portartɪ dentro?/,A2,,A2,
shampoo,shampoo,/ʃaːmpo/,This shampoo is supposedly for dandruff.,Questo shampoo è indicato per la forfora.,/kwesto ʃaːmpo e indikato per la forfora./,A2,Shopping,"A2,Shopping",
shape,forma,/forma/,The general shape of the prison was square.,La forma generale della prigione era quadrata.,/la forma dʒenerale della pridʒone ɛra kwadrata./,A2,Food,"A2,Food",
sheet,foglio,/fɔʎo/,On the same sheet are the passages No.,Sullo stesso foglio sono riportati i brani No.,/sʊllo stesso fɔʎo sono riportatɪ i branɪ nɔ./,A2,Social,"A2,Social",
shell,conchiglia,/konkiʎa/,It was a mere shell.,Era un semplice guscio.,/ɛra ʊn semplitʃe ɡuʃo./,A2,Food,"A2,Food",
shine,brillare,/brillare/,Why does it not shine?,Perché non brilla?,/perke non brilla?/,A2,Emotions,"A2,Emotions",
shock,shock,/ʃɔkː/,"What, then, was the shock which Mrs.","Qual è stato, dunque, lo shock che Mrs.","/kwal e stato, dunkwe, lo ʃɔkː ke ɛmmeɛrɾeɛsse./",A2,Shopping,"A2,Shopping",
shoot,sparare,/spaɾare/,"Rather, it has only reached the shoots.","Piuttosto, ha raggiunto solo i germogli.","/pjʊtːɔsto, a radʒːunto solo i dʒermoʎɪ./",A2,Food,"A2,Food",
shop,negozio,/neɡɔtsio/,The shop was close and hot.,Il negozio era vicino e caldo.,/il neɡɔtsio ɛra vitʃino e kaldo./,A2,Shopping,"A2,Shopping",
shore,riva,/riva/,What is the far shore?,Che cos'è la riva lontana?,/ke kozɛ la riva lontana?/,A2,Shopping,"A2,Shopping",
short,breve,/brɛve/,There was a short pause.,C'è stata una breve pausa.,/tʃe stata ʊna brɛve paʊza./,A2,Food,"A2,Food",
shot,colpo,/kolpo/,And they have shot him.,E gli hanno sparato.,/e ʎɪ anno spaɾato./,A2,Social,"A2,Social",
shout,grido,/ɡrido/,Whatever is there to shout over?,Cosa c'è da gridare?,/kɔza tʃe da ɡridare?/,A2,Social,"A2,Social",
shut,chiuso,/kjuzo/,All the galleries are shut.,Tutte le gallerie sono chiuse.,/tutːe le ɡallerie sono kjuze./,A2,Grammar,"A2,Grammar",
sightseeing,visite turistiche,/vizite tʊristike/,↩ Evidently an excursion for sightseeing was popular.,Evidentemente un'escursione per visitare la città era molto apprezzata.,/evidentemente ʊneskʊrsjone per vizitare la tʃitːa ɛra molto apːretsːata./,A2,Travel,"A2,Travel",
significant,significativo,/siɲifikativo/,How significant is one measly Nāḷandā?,Quanto è significativo un misero Nāḷeā?,/kwanto e siɲifikativo ʊn mizero ɛnne aːmakron letːeːraunoeːtresɛtːe e aːmakron?/,A2,Grammar,"A2,Grammar",
silence,silenzio,/silɛntsio/,This is called noble silence.,Questo si chiama nobile silenzio.,/kwesto sɪ kjama nɔbile silɛntsio./,A2,Health,"A2,Health",
silently,silenziosamente,/silentsjozamente/,"Nicholas could say no more, and silently withdrew.",Nicholas non riuscì a dire altro e si ritirò in silenzio.,/nikolas non riʊʃi a dire altro e sɪ ritiɾɔ in silɛntsio./,A2,Grammar,"A2,Grammar",
silly,sciocco,/ʃɔkːo/,We can’t have any weak or silly.,Non possiamo avere nessun debole o sciocco.,/non possjamo avere nessʊn debole o ʃɔkːo./,A2,Social,"A2,Social",
silver,argento,/ardʒɛnto/,I took this for silver.,L'ho preso per l'argento.,/lo prezo per lardʒɛnto./,A2,Grammar,"A2,Grammar",
simple,semplice,/semplitʃe/,He’s simple and tells much.,È semplice e racconta molto.,/e semplitʃe e rakːonta molto./,A2,Social,"A2,Social",
simply,semplicemente,/semplitʃemente/,The matter is simply this.,La questione è semplicemente questa.,/la kwestjone e semplitʃemente kwesta./,A2,Grammar,"A2,Grammar",
since,da,/da/,Has he been here since?,È stato qui da allora?,/e stato kwi da allora?/,A2,,A2,
singing,canto,/kanto/,And went away singing to himself.,E se ne andò cantando tra sé e sé.,/e se ne andɔ kantando tra se e se./,A2,Social,"A2,Social",
single,singolo,/siŋɡolo/,That single thought is enough.,Questo singolo pensiero è sufficiente.,/kwesto siŋɡolo pensiɛro e sʊffitʃɛnte./,A2,Time & Quantity,"A2,Time & Quantity",
singular,singolare,/siŋɡolare/,Their reasons were singular and abstruse.,Le loro ragioni erano singolari e astruse.,/le lɔro radʒoːnɪ ɛrano siŋɡolarɪ e astruze./,A2,Social,"A2,Social",
sink,lavello,/lavɛllo/,Have you a mind to sink?,Avete intenzione di affondare?,/avete intentsione dɪ affondare?/,A2,Shopping,"A2,Shopping",
sitting,seduta,/seduta/,Why are you sitting here?,Perché sei seduto qui?,/perke sɛi seduto kwi?/,A2,Social,"A2,Social",
skate,pattino,/patːino/,"The turbot, John-dory, skate and sole, which were very dear, were reserved for the rich.","Il rombo, il merluzzo, la razza e la sogliola, che erano molto cari, erano riservati ai ricchi.","/il rombo, il merlutsːo, la ratsːa e la sɔʎola, ke ɛrano molto karɪ, ɛrano rizervatɪ aj rikːɪ./",A2,Shopping,"A2,Shopping",
skateboarding,skateboard,/skateboard/,Tom is skateboarding inside the half-pipe.,Tom sta facendo skateboard all'interno dell'half-pipe.,/tɔm sta fatʃɛndo skateboard allintɛrno dellhalfpipe./,A2,Travel,"A2,Travel",
skating,pattinaggio,/patːinadʒːo/,"Everybody is so hateful, I'll ask Laurie to go skating.",Sono tutti così odiosi che chiederò a Laurie di andare a pattinare.,/sono tutːɪ kozi odjɔzɪ ke kjedeɾɔ a laʊrie dɪ andare a patːinare./,A2,Travel,"A2,Travel",
ski,sci,/ʃi/,For this exploit the ragamuffin is lauding him to the skies!,Per questo exploit lo straccione lo loda fino al cielo!,/per kwesto eksplɔit lo stratʃːone lo lɔda fino al tʃɛlo!/,A2,Shopping,"A2,Shopping",
skiing,sci,/ʃi/,She is good at skiing.,È brava a sciare.,/e brava a ʃiare./,A2,Travel,"A2,Travel",
skin,pelle,/pɛlle/,The chapter on skins is finished.,Il capitolo sulle pelli è terminato.,/il kapitolo sʊlle pɛllɪ e terminato./,A2,Food,"A2,Food",
slave,schiavo,/skjavo/,"You came for gold, ye slaves.","Siete venuti per l'oro, schiavi.","/sjete venutɪ per lɔro, skjavɪ./",A2,Social,"A2,Social",
