English_Translation,Italian_Term,Italian_IPA,English_Sentence,Italian_Sentence,Italian_Sentence_IPA,CEFR_Level,Taxonomy,Tags,Notes
condition,condizione,/konditsione/,The condition is laid down.,La condizione è stabilita.,/la konditsione e stabilita./,A2,Social,"A2,Social",
conference,conferenza,/konferɛntsa/,The conference was a long one.,La conferenza è stata lunga.,/la konferɛntsa e stata luŋɡa./,A2,Social,"A2,Social",
confident,fiducioso,/fidʊtʃozo/,"Be confident to speak, Northumberland.","Siate sicuri di parlare, Northumberland.","/sjate sikurɪ dɪ parlare, nortʊmbɛrland./",A2,Grammar,"A2,Grammar",
confuse,confondere,/konfondere/,"My love, ” said I, “it quite confuses me.","Amore mio"", dissi, ""mi confonde abbastanza.","/amore mio"", dissɪ, ""mɪ konfonde abːastantsa./",A2,Food,"A2,Food",
confused,confuso,/konfuzo/,"I’ve been foolish, confused, and unskillful.","Sono stato sciocco, confuso e poco abile.","/sono stato ʃɔkːo, konfuzo e pɔko abile./",A2,Food,"A2,Food",
connect,collegare,/kolleɡare/,There is nothing to connect Stephen with the religion of Domitilla.,Non c'è nulla che colleghi Stefano alla religione di Domitilla.,/non tʃe nulla ke kolleɡɪ stefano alla relidʒone dɪ domitilla./,A2,Professional,"A2,Professional",
connected,collegato,/kolleɡato/,The chapter connected with Campā is finished.,Il capitolo relativo a Campā è terminato.,/il kapitolo relativo a kampa e terminato./,A2,Grammar,"A2,Grammar",
consequence,conseguenza,/konseɡwɛntsa/,What would be the consequence?,Quali sarebbero le conseguenze?,/kwalɪ sarebːero le konseɡwɛntse?/,A2,Abstract,"A2,Abstract",
consider,considerare,/konsiderare/,I will consider my child!,Considererò mio figlio!,/konsidereɾɔ mio fiʎo!/,A2,Social,"A2,Social",
consist,consistente,/konsistɛnte/,Of what does meat extract mainly consist?,Di cosa è composto principalmente l'estratto di carne?,/dɪ kɔza e komposto printʃipalmente lestratːo dɪ karne?/,A2,Food,"A2,Food",
contact,contatto,/kontatːo/,… You should say: ‘Contact.,"... Si dovrebbe dire: ""Contatto.","/... sɪ dovrɛbːe dire: ""kontatːo./",A2,Social,"A2,Social",
contain,contenere,/kontenere/,Is’t like that lead contains her?,Non è che quella pista la contiene?,/non e ke kwella pista la kontjɛne?/,A2,Professional,"A2,Professional",
container,contenitore,/kontenitore/,There was no container for the wiping sticks.,Non c'era un contenitore per i bastoncini pulenti.,/non tʃɛra ʊn kontenitore per i bastontʃinɪ pʊlɛntɪ./,A2,Shopping,"A2,Shopping",
context,contesto,/kontɛsto/,What is appropriate depends on context.,Ciò che è appropriato dipende dal contesto.,/tʃɔ ke e apːropriato dipɛnde dal kontɛsto./,A2,Social,"A2,Social",
continent,continente,/kontinɛnte/,The sea has its large rivers like the continents.,Il mare ha i suoi grandi fiumi come i continenti.,/il mare a i sʊɔi ɡrandɪ fjumɪ kome i kontinɛntɪ./,A2,Grammar,"A2,Grammar",
continue,continuare,/kontinʊare/,Things cannot continue as they are.,Le cose non possono continuare così.,/le kɔze non pɔssono kontinʊare kozi./,A2,Professional,"A2,Professional",
contrast,contrasto,/kontrasto/,"Alas, how great was the contrast between us!","Ahimè, quanto era grande il contrasto tra noi!","/aimɛ, kwanto ɛra ɡrande il kontrasto tra noi!/",A2,Social,"A2,Social",
control,controllo,/kontrɔllo/,She could not control her mirth.,Non riuscì a controllare la sua allegria.,/non riʊʃi a kontrollare la sʊa alleɡria./,A2,Social,"A2,Social",
convenience,convenienza,/konvenjɛntsa/,"Now, Puṇṇa, go at your convenience.","Ora, Puṇṇa, vai a tuo piacimento.","/ora, pi u letːeːraunoeːkwatːrosɛtːe letːeːraunoeːkwatːrosɛtːe a, vaj a tʊo pjatʃimento./",A2,Shopping,"A2,Shopping",
convenient,conveniente,/konveniɛnte/,"Your hat, however, is the most convenient.","Il cappello, tuttavia, è il più comodo.","/il kapːɛllo, tʊtːavia, e il pjʊ kɔmodo./",A2,Grammar,"A2,Grammar",
cooker,fornello,/fornɛllo/,Pressure cookers are a true convenience.,Le pentole a pressione sono una vera comodità.,/le pentole a pressjone sono ʊna vera komodita./,A2,Shopping,"A2,Shopping",
cooler,refrigeratore,/refridʒeratore/,"You’re not so hurried now, Rachael, and your hand is cooler.","Ora non sei più così frettolosa, Rachael, e la tua mano è più fresca.","/ora non sɛi pjʊ kozi fretːoloza, ratʃael, e la tʊa mano e pjʊ freska./",A2,Food,"A2,Food",
correctly,correttamente,/korɾetːamente/,It has been correctly memorized by that mendicant.,È stato memorizzato correttamente da quel mendicante.,/e stato memoridzːato korɾetːamente da kwel mendikante./,A2,Grammar,"A2,Grammar",
count,conteggio,/kontedʒːo/,You should count the monks.,Dovresti contare i monaci.,/dovrestɪ kontare i mɔnatʃɪ./,A2,Social,"A2,Social",
countryside,campagna,/kampaɲɲa/,We are in the countryside.,Siamo in campagna.,/sjamo in kampaɲɲa./,A2,Professional,"A2,Professional",
couple,coppia,/kɔpːia/,Let’s be a comfortable couple.,Diventiamo una coppia confortevole.,/diventjamo ʊna kɔpːia konfortevole./,A2,Time & Quantity,"A2,Time & Quantity",
court,tribunale,/tribʊnale/,Are we at Freeman’s Court?,Siamo a Freeman's Court?,/sjamo a freemans koʊrt?/,A2,Social,"A2,Social",
crazy,pazzo,/patsːo/,Who said I was crazy about him?,Chi ha detto che sono pazza di lui?,/kɪ a detːo ke sono patsːa dɪ lui?/,A2,Social,"A2,Social",
creative,creativo,/kreativo/,Perhaps Sāriputta was demonstrating his talent for creative rephrasing and synthesis.,Forse Sāriputta stava dimostrando il suo talento per la riformulazione e la sintesi creativa.,/forse sariputːa stava dimostrando il sʊo talɛnto per la riformʊlatsione e la sintezɪ kreativa./,A2,Grammar,"A2,Grammar",
creativity,creatività,/kreativita/,Following the rules was a constraint on my creativity.,Seguire le regole era un vincolo alla mia creatività.,/seɡwire le rɛɡole ɛra ʊn vinkolo alla mia kreativita./,A2,Grammar,"A2,Grammar",
creature,creatura,/kreatura/,Creatures are thoughts of God.,Le creature sono pensieri di Dio.,/le kreature sono pensiɛrɪ dɪ dio./,A2,Social,"A2,Social",
credit,credito,/kredito/,"It does her credit, Mat!","Le fa onore, Mat!","/le fa onore, mat!/",A2,Social,"A2,Social",
cricket,grillo,/ɡrillo/,"Aye, aye, sir, ’ said Steelkilt, merry as a cricket.","Sì, sì, signore"", disse Steelkilt, allegro come un grillo.","/siː, siː, siɲore"", disse steɛlkilt, alleɡro kome ʊn ɡrillo./",A2,Home,"A2,Home",
crime,crimine,/krimine/,Had he committed any crime?,Aveva commesso qualche reato?,/aveva kommesso kwalke reato?/,A2,Activities,"A2,Activities",
criminal,criminale,/kriminale/,This criminal has not full man-brain.,Questo criminale non ha un cervello umano completo.,/kwesto kriminale non a ʊn tʃervɛllo ʊmano komplɛto./,A2,Social,"A2,Social",
crisp,croccante,/krokːante/,These crisps are very moreish.,Queste patatine sono molto gustose.,/kweste patatine sono molto ɡʊstoze./,A2,Food,"A2,Food",
criticize,criticare,/kritikare/,Nor do I criticize all sacrifices.,Non critico nemmeno tutti i sacrifici.,/non kritiko nemmeno tutːɪ i sakrifitʃɪ./,A2,Social,"A2,Social",
cross,croce,/krotʃe/,How shall we cross the river?,Come possiamo attraversare il fiume?,/kome possjamo atːraversare il fjume?/,A2,Food,"A2,Food",
crowd,folla,/fɔlla/,The crowd was in a tumult.,La folla era in tumulto.,/la fɔlla ɛra in tʊmulto./,A2,Professional,"A2,Professional",
crowded,affollato,/affollato/,They were crowded in proportion to their scarcity.,Erano affollati in proporzione alla loro scarsità.,/ɛrano affollatɪ in proportsione alla lɔro skarsita./,A2,Grammar,"A2,Grammar",
crown,corona,/korona/,Harry the Fifth is crown’d.,Harry Quinto viene incoronato.,/hɛːrɾɪ kwinto vjɛne inkoronato./,A2,Social,"A2,Social",
cruise,crociera,/krotʃɛra/,Sami went on a cruise.,Sami è andato in crociera.,/samɪ e andato in krotʃɛra./,A2,Travel,"A2,Travel",
cupboard,armadio,/armadio/,"Out of a cupboard, ” said I.","Da un armadio"", dissi.","/da ʊn armadio"", dissɪ./",A2,Shopping,"A2,Shopping",
curly,riccio,/ritʃːo/,"Then for Hrothgar a war-horse was decked with a bridle, Curly-maned courser.","Poi per Hrothgar fu addobbato un cavallo da guerra con le briglie, un cavallo a pelo corto.","/pɔi per rotɡar fʊ adːobːato ʊn kavallo da ɡwɛrɾa kon le briʎe, ʊn kavallo a pelo korto./",A2,Grammar,"A2,Grammar",
curry,curry,/kurɾɪ/,They had prepared mango curry.,Avevano preparato il curry di mango.,/avevano prepaɾato il kurɾɪ dɪ maŋɡo./,A2,Food,"A2,Food",
curse,maledizione,/maleditsione/,The curse has passed away!,La maledizione è passata!,/la maleditsione e passata!/,A2,Social,"A2,Social",
custom,personalizzato,/personalidzːato/,"In accordance with custom, "" says M.","Secondo la consuetudine"", dice M.","/sekondo la konsʊetudine"", ditʃe ɛmme./",A2,Grammar,"A2,Grammar",
cycle,ciclo,/tʃiklo/,I will discuss this cycle further below.,Discuterò questo ciclo più avanti.,/diskʊteɾɔ kwesto tʃiklo pjʊ avantɪ./,A2,Time & Quantity,"A2,Time & Quantity",
cycling,ciclismo,/tʃiklizmo/,Poṭṭhapāda is simply cycling through possible self theories without really thinking through the implications.,Poṭṭhapāda sta semplicemente passando in rassegna le possibili teorie del sé senza riflettere realmente sulle implicazioni.,/pi o letːeːraunoeːsɛjd̪iː letːeːraunoeːsɛjd̪iː akːa a pi aːmakron d̪iː a sta semplitʃemente passando in rasseɲɲa le possibilɪ teorie del se sɛntsa rifletːere realmente sʊlle implikatsionɪ./,A2,Travel,"A2,Travel",
daily,giornaliero,/dʒornaliɛro/,"Though it has not yet finally disappeared, it is dwindling daily.","Anche se non è ancora scomparsa definitivamente, si sta riducendo ogni giorno.","/anke se non e ankora skomparsa definitivamente, sɪ sta ridʊtʃɛndo oɲɲɪ dʒorno./",A2,Social,"A2,Social",
dam,diga,/diɡa/,"I say, pull like god-dam, ”—cried the Indian.","Dico, tira come Dio comanda"", gridò l'indiano.","/diko, tira kome dio komanda"", ɡridɔ lindjano./",A2,Time & Quantity,"A2,Time & Quantity",
danger,pericolo,/perikolo/,Is there danger of another?,C'è il pericolo di un altro?,/tʃe il perikolo dɪ ʊn altro?/,A2,Professional,"A2,Professional",
data,dati,/datɪ/,[Footnote: A few more recent data may be given here to facilitate comparison.,"[Nota: per facilitare il confronto, si riportano alcuni dati più recenti.","/[nɔta: per fatʃilitare il konfronto, sɪ ripɔrtano alkʊnɪ datɪ pjʊ retʃɛntɪ./",A2,Grammar,"A2,Grammar",
daylight,luce diurna,/lutʃe djurna/,It was getting gray daylight now.,Ormai la luce del giorno si stava facendo grigia.,/ormaɪ la lutʃe del dʒorno sɪ stava fatʃɛndo ɡridʒa./,A2,Time & Quantity,"A2,Time & Quantity",
dead,morto,/mɔrto/,The Brothers are now dead.,I Fratelli sono morti.,/i fratɛllɪ sono mɔrtɪ./,A2,Time & Quantity,"A2,Time & Quantity",
deal,accordo,/akːɔrdo/,You should deal with that first.,Dovresti occuparti prima di tutto di questo.,/dovrestɪ okːʊpartɪ prima dɪ tutːo dɪ kwesto./,A2,Social,"A2,Social",
death,morte,/mɔrte/,Without was the “Red Death.,"Senza la ""Morte Rossa"".","/sɛntsa la ""mɔrte rossa""./",A2,Social,"A2,Social",
debate,dibattito,/dibatːito/,Hatthaka the Sakyan was beaten in debate.,Hatthaka il Sakyan fu sconfitto in un dibattito.,/hatːaka il sakjan fʊ skonfitːo in ʊn dibatːito./,A2,Social,"A2,Social",
decision,decisione,/detʃizione/,And how is there majority decision?,E come si fa a decidere a maggioranza?,/e kome sɪ fa a detʃidere a madʒːorantsa?/,A2,Grammar,"A2,Grammar",
deep,profondo,/profondo/,It doesn’t have deep furrows.,Non ha solchi profondi.,/non a solkɪ profondɪ./,A2,Time & Quantity,"A2,Time & Quantity",
deeply,profondamente,/profondamente/,It is too deeply branded.,È un marchio troppo profondo.,/e ʊn markio trɔpːo profondo./,A2,Grammar,"A2,Grammar",
definitely,definitivamente,/definitivamente/,"I know, ” he said definitely.","Lo so"", ha detto con decisione.","/lo sɔ"", a detːo kon detʃizione./",A2,Grammar,"A2,Grammar",
degree,grado,/ɡrado/,And what is thy degree?,E qual è il tuo grado?,/e kwal e il tʊo ɡrado?/,A2,Social,"A2,Social",
delay,ritardo,/ritardo/,I would not be delay’d.,Non voglio ritardare.,/non voʎo ritardare./,A2,Time & Quantity,"A2,Time & Quantity",
dentist,dentista,/dentista/,The dentist said I had pulpitis.,Il dentista ha detto che avevo la pulpite.,/il dentista a detːo ke avevo la pulpite./,A2,Social,"A2,Social",
department,reparto,/reparto/,Geniality has invaded each department and profession.,La genialità ha invaso ogni reparto e professione.,/la dʒenjalita a invazo oɲɲɪ reparto e professjone./,A2,Grammar,"A2,Grammar",
department,reparto,/reparto/,Geniality has invaded each department and profession.,La genialità ha invaso ogni reparto e professione.,/la dʒenjalita a invazo oɲɲɪ reparto e professjone./,A2,Grammar,"A2,Grammar",
depend,dipendere,/dipɛndere/,You may depend upon me.,Potete contare su di me.,/potete kontare sʊ dɪ me./,A2,Social,"A2,Social",
desert,deserto,/dezɛrto/,Now you shall receive your deserts.,Ora riceverete i vostri meriti.,/ora ritʃeverete i vɔstrɪ mɛritɪ./,A2,Professional,"A2,Professional",
designer,designer,/dezaɪner/,"Among software designers, comes from C's and LISP's 0-based indexing of arrays.","Tra i progettisti di software, deriva dall'indicizzazione degli array basata su 0 di C e LISP.","/tra i prodʒetːistɪ dɪ sɔft̪wer, deriva dallinditʃidzːatsione deʎɪ arɾai bazata sʊ dzɛɾo dɪ tʃi e lisp./",A2,Social,"A2,Social",
dessert,dessert,/dɛsser/,Then came the dessert and some more toasts.,Poi sono arrivati il dessert e altri brindisi.,/pɔi sono arɾivatɪ il dɛsser e altrɪ brindizɪ./,A2,Food,"A2,Food",
destroy,distruggere,/distrudʒːere/,And how does a mendicant destroy?,E come distrugge un mendicante?,/e kome distrudʒːe ʊn mendikante?/,A2,Food,"A2,Food",
detective,detective,/detɛktiv/,"One of those omniscient and awe-inspiring marvels, a detective, came up from St.","Una di queste meraviglie onniscienti e stupefacenti, un detective, arrivò da St.","/ʊna dɪ kweste meraviʎe onniʃɛntɪ e stʊpefatʃɛntɪ, ʊn detɛktiv, arɾivɔ da ɛssetɪ./",A2,Social,"A2,Social",
develop,sviluppare,/zvilʊpːare/,You should develop it with rapture.,Dovreste svilupparlo con estasi.,/dovreste zvilʊpːarlo kon ɛstazɪ./,A2,Food,"A2,Food",
developed,sviluppato,/zvilʊpːato/,A developed mind is workable.,Una mente sviluppata è praticabile.,/ʊna mente zvilʊpːata e pratikabile./,A2,Food,"A2,Food",
device,dispositivo,/dispozitivo/,What says Andronicus to this device?,Cosa dice Andronico di questo dispositivo?,/kɔza ditʃe andrɔniko dɪ kwesto dispozitivo?/,A2,Social,"A2,Social",
diamond,diamante,/djamante/,And who has a mind like diamond?,E chi ha una mente come il diamante?,/e kɪ a ʊna mente kome il djamante?/,A2,Shopping,"A2,Shopping",
diary,diario,/djario/,He is now reading his wife’s typescript of my diary.,Sta leggendo il dattiloscritto di sua moglie del mio diario.,/sta ledʒːɛndo il datːiloskritːo dɪ sʊa moʎe del mio djario./,A2,Social,"A2,Social",
differently,diversamente,/diversamente/,"The commentary, however, sees most of this quite differently.","Il commento, tuttavia, vede la maggior parte di questo aspetto in modo molto diverso.","/il kommento, tʊtːavia, vede la madʒːor parte dɪ kwesto aspɛtːo in mɔdo molto divɛrso./",A2,Grammar,"A2,Grammar",
difficulty,difficoltà,/diffikolta/,That would be no difficulty.,Non sarebbe difficile.,/non sarɛbːe diffitʃile./,A2,Grammar,"A2,Grammar",
digital,digitale,/didʒitale/,Creation Process Primary source was the digital Mahāsaṅgīti edition of the Pali Tipiṭaka.,Processo di creazione La fonte primaria è stata l'edizione digitale Mahāsaṅgīti del Pali Tipiṭaka.,/protʃɛsso dɪ kreatsione la fonte primaria e stata leditsione didʒitale ɛmme a akːa aːmakron ɛsse a letːeːraunoeːkwatːrotʃinkwe dʒi iːmakron tɪ i del palɪ tɪ i pi i letːeːraunoeːsɛjd̪iː a kapːa a./,A2,Grammar,"A2,Grammar",
digital,digitale,/didʒitale/,Creation Process Primary source was the digital Mahāsaṅgīti edition of the Pali Tipiṭaka.,Processo di creazione La fonte primaria è stata l'edizione digitale Mahāsaṅgīti del Pali Tipiṭaka.,/protʃɛsso dɪ kreatsione la fonte primaria e stata leditsione didʒitale ɛmme a akːa aːmakron ɛsse a letːeːraunoeːkwatːrotʃinkwe dʒi iːmakron tɪ i del palɪ tɪ i pi i letːeːraunoeːsɛjd̪iː a kapːa a./,A2,Grammar,"A2,Grammar",
dinosaur,dinosauro,/dinozaʊro/,And the dinosaurs are gone.,E i dinosauri non ci sono più.,/e i dinozaʊrɪ non tʃɪ sono pju./,A2,Home,"A2,Home",
direct,diretto,/dirɛtːo/,"He was direct, blunt even.","Era diretto, addirittura schietto.","/ɛra dirɛtːo, adːiritːura skjetːo./",A2,Food,"A2,Food",
direction,direzione,/diretsione/,This is the first direction.,Questa è la prima direzione.,/kwesta ɛ la prima diretsione./,A2,Social,"A2,Social",
director,direttore,/diretːore/,The man bending over her is her director.,L'uomo che si china su di lei è il suo regista.,/lwɔmo ke sɪ kina sʊ dɪ lɛi e il sʊo redʒista./,A2,Social,"A2,Social",
disadvantage,svantaggio,/zvantadʒːo/,Were at a considerable disadvantage.,Erano in una posizione di notevole svantaggio.,/ɛrano in ʊna pozitsione dɪ notevole zvantadʒːo./,A2,Professional,"A2,Professional",
disagree,in disaccordo,/in dizakːɔrdo/,Did it disagree with her?,Non era d'accordo con lei?,/non ɛra dakːɔrdo kon lɛi?/,A2,Social,"A2,Social",
disappear,scomparire,/skomparire/,Had the crew seen me disappear?,L'equipaggio mi aveva visto sparire?,/lekwipadʒːo mɪ aveva visto sparire?/,A2,Time & Quantity,"A2,Time & Quantity",
disappointed,deluso,/deluzo/,His designs were disappointed by death.,I suoi progetti sono stati delusi dalla morte.,/i sʊɔi prodʒɛtːɪ sono statɪ deluzɪ dalla mɔrte./,A2,Grammar,"A2,Grammar",
disappointing,deludente,/delʊdɛnte/,"↩ After Sakka’s disappointing response, Moggallāna is trying to say something nice.","Dopo la deludente risposta di Sakka, Moggallāna cerca di dire qualcosa di carino.","/dopo la delʊdɛnte risposta dɪ sakːa, moɡːallana tʃerka dɪ dire kwalkɔza dɪ karino./",A2,Grammar,"A2,Grammar",
disaster,disastro,/dizastro/,She thought a disaster was averted.,Pensava che un disastro fosse stato evitato.,/pensava ke ʊn dizastro fosse stato evitato./,A2,Health,"A2,Health",
disco,discoteca,/diskotɛka/,You absolutely may not go to the disco.,Non potete assolutamente andare in discoteca.,/non potete assolʊtamente andare in diskotɛka./,A2,Social,"A2,Social",
discover,scoprire,/skoprire/,Did you discover this passage by chance?,Ha scoperto questo passaggio per caso?,/a skopɛrto kwesto passadʒːo per kazo?/,A2,Food,"A2,Food",
discovery,scoperta,/skopɛrta/,This is the new discovery.,Questa è la nuova scoperta.,/kwesta ɛ la nʊɔva skopɛrta./,A2,Social,"A2,Social",
discussion,discussione,/diskʊssjone/,Another point has had some discussion.,Un altro punto è stato oggetto di discussione.,/ʊn altro punto e stato odʒːɛtːo dɪ diskʊssjone./,A2,Social,"A2,Social",
disease,malattia,/malatːia/,"He has an eye-disease, sir.","Ha una malattia agli occhi, signore.","/a ʊna malatːia aʎɪ ɔkːɪ, siɲore./",A2,Health,"A2,Health",
dishonest,disonesto,/dizonɛsto/,"But know, whatever fate I am to try, By no dishonest wound shall Hector die.","Ma sappiate che, qualunque sia la sorte che mi attende, per nessuna ferita disonesta morirà Ettore.","/ma sapːjate ke, kwalunkwe sia la sɔrte ke mɪ atːɛnde, per nessʊna ferita dizonɛsta moriɾa ɛtːore./",A2,Grammar,"A2,Grammar",
dislike,antipatia,/antipatia/,It is an idiom expressing dislike.,È un idioma che esprime antipatia.,/e ʊn idjɔma ke esprime antipatia./,A2,Grammar,"A2,Grammar",
display,display,/displei/,The Huguenot army made a brave display.,L'esercito ugonotto fece un'esibizione coraggiosa.,/lezɛrtʃito ʊɡonɔtːo fetʃe ʊnezibitsione koradʒːɔza./,A2,Social,"A2,Social",
distance,distanza,/distantsa/,The distance is ten miles.,La distanza è di dieci miglia.,/la distantsa e dɪ djɛtʃɪ miʎa./,A2,Time & Quantity,"A2,Time & Quantity",
disturb,disturbare,/distʊrbare/,Do not disturb the cobra!,Non disturbate il cobra!,/non distʊrbate il kɔbra!/,A2,Emotions,"A2,Emotions",
divide,dividere,/dividere/,It is deeds that divide beings into inferior and superior.,Sono le azioni che dividono gli esseri in inferiori e superiori.,/sono le atsionɪ ke dividono ʎɪ ɛsserɪ in inferiorɪ e sʊperiorɪ./,A2,Professional,"A2,Professional",
divorced,divorziato,/divortsjato/,"He became anxious … “Were they divorced, monk?","Si preoccupò... ""Erano divorziati, monaco?","/sɪ preokːʊpɔ... ""ɛrano divortsjatɪ, mɔnako?/",A2,Grammar,"A2,Grammar",
dizzy,vertigine,/vertidʒine/,"His head was dizzy, and he staggered to and fro like a drunken man.",Gli girava la testa e barcollava come un ubriaco.,/ʎɪ dʒirava la tɛsta e barkollava kome ʊn ʊbriako./,A2,Grammar,"A2,Grammar",
document,documento,/dokʊmento/,See the documents in F.,Si vedano i documenti in F.,/sɪ vedano i dokʊmentɪ in ɛffe./,A2,Social,"A2,Social",
done,fatto,/fatːo/,Then he has done nothing.,Allora non ha fatto nulla.,/allora non a fatːo nulla./,A2,Food,"A2,Food",
double,doppio,/dopːio/,I'll be a double-distilled saint.,Sarò un santo a doppia distillazione.,/saɾɔ ʊn santo a dopːia distillatsione./,A2,Social,"A2,Social",
doubt,dubbio,/dubːio/,You may sleep without doubt.,Potete dormire senza dubbio.,/potete dormire sɛntsa dubːio./,A2,Grammar,"A2,Grammar",
download,scaricare,/skarikare/,Can you download YouTube videos?,È possibile scaricare i video di YouTube?,/e possibile skarikare i video dɪ jʊː tjuːb?/,A2,,A2,
downtown,centro città,/tʃɛntro tʃitːa/,Oh yes; I saw them downtown and follered them.,"Oh sì, li ho visti in centro e li ho seguiti.","/oː siː, lɪ o vistɪ in tʃɛntro e lɪ o seɡwitɪ./",A2,Grammar,"A2,Grammar",
drawer,cassetto,/kassetːo/,"Look in the drawer there, ” he said, pointing at the desk.","Guarda nel cassetto lì"", disse indicando la scrivania.","/ɡwarda nel kassetːo li"", disse indikando la skrivania./",A2,Social,"A2,Social",
drawing,disegno,/dizeɲɲo/,The time is drawing near.,Il momento si avvicina.,/il momento sɪ avvitʃina./,A2,Social,"A2,Social",
dressed,vestito,/vestito/,The passengers were all dressed so oddly too!,Anche i passeggeri erano tutti vestiti in modo strano!,/anke i passedʒːɛrɪ ɛrano tutːɪ vestitɪ in mɔdo strano!/,A2,Food,"A2,Food",
drill,trapano,/trapano/,A sailor takes a fancy to wear shark-bone ear-rings: the carpenter drills his ears.,Un marinaio si diverte a indossare orecchini con ossa di squalo: il falegname gli trapana le orecchie.,/ʊn marinaio sɪ divɛrte a indossare orekːinɪ kon ossa dɪ skwalo: il faleɲame ʎɪ trapana le orekːje./,A2,Shopping,"A2,Shopping",
driver's,conducente,/kondʊtʃɛnte/,Tom and Mary said they didn't have driver's licenses.,Tom e Mary hanno detto di non avere la patente.,/tɔm e mɛːɾɪ anno detːo dɪ non avere la patɛnte./,A2,,A2,
driving,guida,/ɡwida/,What is this you are driving us into?,In cosa ci state portando?,/in kɔza tʃɪ state portando?/,A2,Food,"A2,Food",
drug,farmaco,/farmako/,"This drug is wanted bitter bad, sir, whatever for.","Questa droga è ricercata amaramente, signore, per qualsiasi motivo.","/kwesta drɔɡa e ritʃerkata amaɾamente, siɲore, per kwalsiazɪ motivo./",A2,Food,"A2,Food",
drugstore,farmacia,/farmatʃiːa/,I found out what your ‘drugstores’ were.,"Ho scoperto quali sono le vostre ""farmacie"".","/o skopɛrto kwalɪ sono le vɔstre ""farmatʃie""./",A2,Shopping,"A2,Shopping",
duck,anatra,/anatra/,He was particularly fond of ducks.,Era particolarmente appassionato di anatre.,/ɛra partikolarmente apːassjonato dɪ anatre./,A2,Food,"A2,Food",
dust,polvere,/polvere/,"There was dust, I believe.","C'era polvere, credo.","/tʃɛra polvere, krɛdo./",A2,Activities,"A2,Activities",
earn,guadagnare,/ɡwadaɲare/,How do you earn wealth?,Come si guadagna la ricchezza?,/kome sɪ ɡwadaɲɲa la rikːetsːa?/,A2,Travel,"A2,Travel",
earring,orecchino,/orekːino/,My earrings have tassels hanging from them.,I miei orecchini hanno delle nappe che pendono da essi.,/i mjɛi orekːinɪ anno delle napːe ke pendono da ɛssɪ./,A2,Shopping,"A2,Shopping",
earth,terra,/tɛrɾa/,What on earth do you mean?,Che cosa mai vuoi dire?,/ke kɔza maj vʊɔi dire?/,A2,Grammar,"A2,Grammar",
earthquake,terremoto,/terɾemɔto/,That was a really big earthquake!,È stato un terremoto molto forte!,/e stato ʊn terɾemɔto molto fɔrte!/,A2,Health,"A2,Health",
easily,facilmente,/fatʃilmente/,They are more easily tended.,Sono più facili da curare.,/sono pjʊ fatʃilɪ da kʊrare./,A2,Grammar,"A2,Grammar",
editor,editore,/editore/,Editors been killed that way.,Gli editori sono stati uccisi in questo modo.,/ʎɪ editorɪ sono statɪ ʊtʃːizɪ in kwesto mɔdo./,A2,Social,"A2,Social",
education,educazione,/edʊkatsione/,"My education was neglected, yet I was passionately fond of reading.","La mia istruzione era trascurata, eppure mi appassionava la lettura.","/la mia istrʊtsione ɛra traskʊrata, epːure mɪ apːassjonava la letːura./",A2,Grammar,"A2,Grammar",
educational,educativo,/edʊkativo/,This Association is subsidized by the Bund for its educational work.,Questa Associazione è sovvenzionata dal Bund per il suo lavoro educativo.,/kwesta assotʃatsione e sovventsjonata dal bund per il sʊo lavɔro edʊkativo./,A2,Grammar,"A2,Grammar",
effect,effetto,/effɛtːo/,The effect was dazzling and brilliant.,L'effetto è stato abbagliante e brillante.,/leffɛtːo e stato abːaʎante e brillante./,A2,Social,"A2,Social",
