English_Translation,Italian_Term,Italian_IPA,English_Sentence,Italian_Sentence,Italian_Sentence_IPA,CEFR_Level,Taxonomy,Tags,Notes
granny,nonnina,/nonnina/,"Granny, could you tell me one more story?","Nonna, puoi raccontarmi un'altra storia?","/nɔnna, pʊɔi rakːontarmɪ ʊnaltra stɔria?/",A2,Social,"A2,Social",
grateful,grato,/ɡrato/,"Is he grateful, ma’am, —is he grateful?","È grato, signora, è grato?","/e ɡrato, siɲora, e ɡrato?/",A2,Grammar,"A2,Grammar",
greatly,molto,/molto/,The throat was greatly chafed.,La gola era molto irritata.,/la ɡola ɛra molto irɾitata./,A2,Grammar,"A2,Grammar",
greedy,avido,/avido/,A greedy person doesn’t know the good.,Una persona avida non conosce il bene.,/ʊna persona avida non konoʃe il bɛne./,A2,Grammar,"A2,Grammar",
grilled,alla griglia,/alla ɡriʎa/,The grilled shrimp in Benedito's salad is a game-changer.,I gamberi grigliati nell'insalata di Benedito cambiano le carte in tavola.,/i ɡamberɪ ɡriʎatɪ nellinsalata dɪ benedito kambjano le karte in tavola./,A2,Grammar,"A2,Grammar",
grocery,drogheria,/droɡeria/,Want to come with me to the grocery store?,Vuoi venire con me al supermercato?,/vʊɔi venire kon me al sʊpermerkato?/,A2,Shopping,"A2,Shopping",
guard,guardia,/ɡwardia/,Guards and jailers were unnecessary.,Guardie e carcerieri non erano necessari.,/ɡwardje e kartʃeriɛrɪ non ɛrano netʃessarɪ./,A2,Social,"A2,Social",
guide,guida,/ɡwida/,The guide is no fool.,La guida non è uno sprovveduto.,/la ɡwida non e uno sprovveduto./,A2,Social,"A2,Social",
guidebook,guida,/ɡwida/,The teacher discussed the guidebook in class.,L'insegnante ha discusso la guida in classe.,/linseɲante a diskusso la ɡwida in klasse./,A2,Social,"A2,Social",
gun,pistola,/pistɔla/,Then it is an air-gun.,Allora è un cannone ad aria compressa.,/allora e ʊn kannone ad aria komprɛssa./,A2,Social,"A2,Social",
half-price,metà prezzo,/meta prɛtsːo/,This half-price is common in everyday life.,Questo mezzo prezzo è comune nella vita di tutti i giorni.,/kwesto mɛdzːo prɛtsːo e komune nella vita dɪ tutːɪ i dʒornɪ./,A2,Grammar,"A2,Grammar",
ham,prosciutto,/proʃutːo/,Give the general composition of ham.,Indicare la composizione generale del prosciutto.,/indikare la kompozitsione dʒenerale del proʃutːo./,A2,Social,"A2,Social",
handbag,borsetta,/borsetːa/,Have you ever seen Tom with a handbag?,Avete mai visto Tom con una borsa?,/avete maj visto tɔm kon ʊna borsa?/,A2,Shopping,"A2,Shopping",
handicapped,handicap,/andikap/,"The answer was crushing, Fourquevaux was heavily handicapped, for he could not openly espouse the cause of Frenchmen who were heretics.","La risposta fu schiacciante: Fourquevaux era fortemente ostacolato, perché non poteva sposare apertamente la causa dei francesi eretici.","/la risposta fʊ skjatʃːante: foʊrkwevaʊks ɛra fortemente ostakolato, perke non potɛva spozare apertamente la kaʊza deɪ frantʃezɪ erɛtitʃɪ./",A2,Grammar,"A2,Grammar",
handle,maniglia,/maniʎa/,"It’s only a handle, ’ said Mrs.","È solo una maniglia"", ha detto la signora.","/e solo ʊna maniʎa"", a detːo la siɲora./",A2,Shopping,"A2,Shopping",
happily,felicemente,/felitʃemente/,"Happily, I knew the road intimately.","Fortunatamente, conoscevo bene la strada.","/fortʊnatamente, konoʃɛvo bɛne la strada./",A2,Grammar,"A2,Grammar",
happiness,felicità,/felitʃita/,This is for your happiness.,Questo è per la vostra felicità.,/kwesto ɛ per la vɔstra felitʃita./,A2,Health,"A2,Health",
hardly,difficilmente,/diffitʃilmente/,I can hardly believe that.,Non riesco a crederci.,/non riesko a kredertʃɪ./,A2,Grammar,"A2,Grammar",
harm,danno,/danno/,I have done no harm.,Non ho fatto alcun male.,/non o fatːo alkʊn male./,A2,Health,"A2,Health",
harmful,dannoso,/dannozo/,This is called the harmful.,Questo è chiamato il dannoso.,/kwesto ɛ kjamato il dannozo./,A2,Grammar,"A2,Grammar",
harmony,armonia,/armonia/,He is full of harmony.,È pieno di armonia.,/e pjɛno dɪ armonia./,A2,Social,"A2,Social",
harvest,raccolto,/rakːɔlto/,And the harvest was what I saw!,E il raccolto è stato quello che ho visto!,/e il rakːɔlto e stato kwello ke o visto!/,A2,Abstract,"A2,Abstract",
headphone,cuffie,/kuffje/,Edmundo had his headphones in.,Edmundo aveva le cuffie.,/edmundo aveva le kuffje./,A2,Shopping,"A2,Shopping",
headteacher,direttore didattico,/diretːore didatːiko/,"Tell that to the headteacher, or the acting headteacher.","Ditelo al preside, o al preside in carica.","/ditelo al prɛzide, o al prɛzide in karika./",A2,,A2,
heat,calore,/kalore/,Is it coagulated by heat?,Viene coagulato dal calore?,/vjɛne koaɡʊlato dal kalore?/,A2,Grammar,"A2,Grammar",
heating,riscaldamento,/riskaldamento/,The monks made him sweat by heating him.,I monaci lo facevano sudare riscaldandolo.,/i mɔnatʃɪ lo fatʃevano sʊdare riskaldandolo./,A2,Shopping,"A2,Shopping",
heavily,pesantemente,/pezantemente/,Breathing out heavily they know: ‘I’m breathing out heavily.,"Espirando pesantemente sanno: ""Sto espirando pesantemente"".","/espirando pezantemente sanno: ""stɔ espirando pezantemente""./",A2,Grammar,"A2,Grammar",
height,altezza,/altetsːa/,The fever was at its height.,La febbre era al culmine.,/la fɛbːre ɛra al kulmine./,A2,Health,"A2,Health",
helpful,utile,/utile/,But what quality is helpful for striving?,Ma quale qualità è utile per lottare?,/ma kwale kwalita e utile per lotːare?/,A2,Grammar,"A2,Grammar",
hero,eroe,/erɔe/,"So it is, great hero!","Così è, grande eroe!","/kozi ɛː, ɡrande erɔe!/",A2,Social,"A2,Social",
herself,se stessa,/se stessa/,Gives: she gives it herself.,Dà: lo dà lei stessa.,/da: lo da lɛi stessa./,A2,,A2,
high,alto,/alto/,The temperature is exceedingly high.,La temperatura è molto alta.,/la temperatura e molto alta./,A2,Grammar,"A2,Grammar",
highway,autostrada,/aʊtostrada/,Gallows and knock are too powerful on the highway.,Gallows e knock sono troppo potenti in autostrada.,/ɡallows e knɔkː sono trɔpːo potɛntɪ in aʊtostrada./,A2,Shopping,"A2,Shopping",
hike,escursione,/eskʊrsjone/,Do you hike?,Fai escursioni?,/faːi eskʊrsjonɪ?/,A2,Abstract,"A2,Abstract",
hiking,escursioni,/eskʊrsjonɪ/,They seldom go hiking by themselves.,Raramente fanno escursioni da soli.,/raɾamente fanno eskʊrsjonɪ da sɔlɪ./,A2,Travel,"A2,Travel",
himself,stesso,/stesso/,Perhaps he may hang himself.,Forse potrebbe impiccarsi.,/forse potrɛbːe impikːarsɪ./,A2,,A2,
hip-hop,hip-hop,/ipop/,Hiplet is a new dance style that combines hip-hop and ballet.,L'hiplet è un nuovo stile di danza che combina hip-hop e danza classica.,/liplet e ʊn nʊɔvo stile dɪ dantsa ke kombina ipop e dantsa klassika./,A2,Social,"A2,Social",
hit,colpito,/kolpito/,Have I hit her now?,L'ho colpita adesso?,/lo kolpita adɛsso?/,A2,Food,"A2,Food",
hockey,hockey,/okːeɪ/,I wanted to play hockey.,Volevo giocare a hockey.,/volɛvo dʒokare a okːeɪ./,A2,Activities,"A2,Activities",
honey,miele,/mjɛle/,And who has speech like honey?,E chi ha la parola come il miele?,/e kɪ a la paɾɔla kome il mjɛle?/,A2,Social,"A2,Social",
honor,onore,/onore/,"Honor bright, now; will it?","Onorare la luce, ora; lo farà?","/onorare la lutʃe, ora; lo faɾa?/",A2,Social,"A2,Social",
horror,orrore,/orɾore/,My horror may be conceived.,Il mio orrore può essere concepito.,/il mio orɾore pʊɔ ɛssere kontʃepito./,A2,Shopping,"A2,Shopping",
host,ospite,/ɔspite/,"It is, ’ replied the host.","Lo è"", rispose il padrone di casa.","/lo ɛː"", rispoze il padrone dɪ kaza./",A2,Social,"A2,Social",
hug,abbraccio,/abːratʃːo/,"Is slain in a war with the Hugs, Franks, and Frisians combined.","Viene ucciso in una guerra con gli Abbracci, i Franchi e i Frisoni messi insieme.","/vjɛne ʊtʃːizo in ʊna ɡwɛrɾa kon ʎɪ abːratʃːɪ, i frankɪ e i frizonɪ messɪ insɪɛme./",A2,Activities,"A2,Activities",
huge,enorme,/enorme/,The amount of repetition is huge.,La quantità di ripetizioni è enorme.,/la kwantita dɪ ripetitsionɪ e enorme./,A2,Grammar,"A2,Grammar",
human,umano,/ʊmano/,Are they gods or humans?,Sono dei o umani?,/sono deɪ o ʊmanɪ?/,A2,Grammar,"A2,Grammar",
hunter,cacciatore,/katʃːatore/,This is not hunters’ language.,Questo non è il linguaggio dei cacciatori.,/kwesto non e il liŋɡwadʒːo deɪ katʃːatorɪ./,A2,Social,"A2,Social",
identify,identificare,/identifikare/,The remaining two are difficult to identify.,Gli altri due sono difficili da identificare.,/ʎɪ altrɪ due sono diffitʃilɪ da identifikare./,A2,Social,"A2,Social",
ill,malato,/malato/,You are fevered and ill.,Siete febbricitanti e malati.,/sjete febːritʃitantɪ e malatɪ./,A2,Grammar,"A2,Grammar",
illegal,illegale,/illeɡale/,"In the Institutes, this distinction was abolished and both declared illegal.—M.","Nelle Istituzioni, questa distinzione è stata abolita ed entrambe sono state dichiarate illegali.-M.","/nelle istitʊtsionɪ, kwesta distintsione e stata abolita ed entrambe sono state dikjaɾate illeɡalɪ.ɛmme./",A2,Grammar,"A2,Grammar",
illness,malattia,/malatːia/,I have mentioned my illness.,Ho parlato della mia malattia.,/o parlato della mia malatːia./,A2,Health,"A2,Health",
image,immagine,/immadʒine/,It is a military image.,È un'immagine militare.,/e ʊnimmadʒine militare./,A2,Social,"A2,Social",
imagination,immaginazione,/immadʒinatsione/,Have no imagination at all.,Non hanno alcuna immaginazione.,/non anno alkʊna immadʒinatsione./,A2,Grammar,"A2,Grammar",
immediately,immediatamente,/immedjatamente/,"Immediately after dark, I should hope.",Spero subito dopo il tramonto.,/spero subito dopo il tramonto./,A2,Grammar,"A2,Grammar",
impact,impatto,/impatːo/,No doubt its impact had caused a flash of fire.,Senza dubbio il suo impatto aveva provocato un lampo di fuoco.,/sɛntsa dubːio il sʊo impatːo aveva provokato ʊn lampo dɪ fʊɔko./,A2,Abstract,"A2,Abstract",
impatient,impaziente,/impatsiɛnte/,I am impatient to see him.,Sono impaziente di vederlo.,/sono impatsiɛnte dɪ vedɛrlo./,A2,Grammar,"A2,Grammar",
importance,importanza,/importantsa/,But it is of small importance.,Ma è di poca importanza.,/ma e dɪ pɔka importantsa./,A2,Health,"A2,Health",
importantly,importante,/importante/,"Importantly, it retains something of a sense of being a special or technical word, so it’s less likely to be misunderstood.","È importante notare che mantiene un senso di parola speciale o tecnica, quindi è meno probabile che venga fraintesa.","/e importante notare ke mantjɛne ʊn sɛnso dɪ paɾɔla spetʃale o tɛknika, kwindɪ e meno probabile ke veŋɡa fraɪnteza./",A2,Grammar,"A2,Grammar",
impossible,impossibile,/impossibile/,"It is impossible, ’ said Kate.","È impossibile"", disse Kate.","/e impossibile"", disse keɪt̪./",A2,Grammar,"A2,Grammar",
impress,impressionare,/impressjonare/,"Ajax was here the voluntary, and you as under an impress.","Aiace è stato qui il volontario, e voi come sotto un'impronta.","/aiatʃe e stato kwi il volontario, e voi kome sotːo ʊnimpronta./",A2,Food,"A2,Food",
inch,pollice,/pɔllitʃe/,"He was, indeed, every inch a king.",Era davvero un re a tutti gli effetti.,/ɛra davvero ʊn rɛ a tutːɪ ʎɪ effɛtːɪ./,A2,Time & Quantity,"A2,Time & Quantity",
included,incluso,/inkluzo/,In which recitation is it included?,In quale recita è inclusa?,/in kwale rɛtʃita e inkluza?/,A2,Grammar,"A2,Grammar",
including,incluso,/inkluzo/,"Including them, the same dinner would cost three napoleons.","Includendoli, la stessa cena sarebbe costata tre napoleoni.","/inklʊdendolɪ, la stessa tʃena sarɛbːe kostata tre napoleonɪ./",A2,Professional,"A2,Professional",
increase,aumento,/aʊmento/,"I said: “see, it increases.","Ho detto: ""vedi, aumenta.","/o detːo: ""vedɪ, aʊmenta./",A2,Time & Quantity,"A2,Time & Quantity",
incredible,incredibile,/inkredibile/,Do you think it incredible that Mr.,Vi sembra incredibile che Mr.,/vɪ sembra inkredibile ke ɛmmeɛrɾe./,A2,Grammar,"A2,Grammar",
indeed,infatti,/infatːɪ/,"I do, indeed, ’ replied Nicholas.","Lo so, infatti"", rispose Nicholas.","/lo sɔ, infatːɪ"", rispoze nikolas./",A2,Grammar,"A2,Grammar",
independence,indipendenza,/indipendɛntsa/,Take your independence and be gone.,Prendete la vostra indipendenza e andatevene.,/prendete la vɔstra indipendɛntsa e andatevene./,A2,Professional,"A2,Professional",
independent,indipendente,/indipendɛnte/,One gives a gift to an independent Buddha.,Si fa un regalo a un Buddha indipendente.,/sɪ fa ʊn reɡalo a ʊn budːa indipendɛnte./,A2,Social,"A2,Social",
indicate,indicare,/indikare/,What heat does the thermometer really indicate?,Quale calore indica realmente il termometro?,/kwale kalore indika realmente il termɔmetro?/,A2,Social,"A2,Social",
individual,individuale,/individʊale/,He was a humble individual.,Era un individuo umile.,/ɛra ʊn individʊo umile./,A2,Social,"A2,Social",
indoor,interno,/intɛrno/,"What am I to say, indoors?","Cosa devo dire, in casa?","/kɔza dɛvo dire, in kaza?/",A2,Grammar,"A2,Grammar",
industry,industria,/industria/,The great industry of the city was silk manufacturing.,La grande industria della città era la produzione di seta.,/la ɡrande industria della tʃitːa ɛra la prodʊtsione dɪ seta./,A2,Professional,"A2,Professional",
inexpensive,economico,/ekonɔmiko/,"Dear me, they are inexpensive, but they are quite wonderful!","Cari miei, sono poco costosi, ma sono davvero meravigliosi!","/karɪ mjɛi, sono pɔko kostɔzɪ, ma sono davvero meraviʎɔzɪ!/",A2,Grammar,"A2,Grammar",
influence,influenza,/inflʊɛntsa/,Have you no influence over him?,Non avete alcuna influenza su di lui?,/non avete alkʊna inflʊɛntsa sʊ dɪ lui?/,A2,Social,"A2,Social",
informal,informale,/informale/,"For the rest, though it might be somewhat informal, the gentleman might not object to doing a little business on board.","Per il resto, anche se potrebbe essere un po' informale, il gentiluomo non si opporrebbe a fare un po' di affari a bordo.","/per il rɛsto, anke se potrɛbːe ɛssere ʊn po informale, il dʒentilʊɔmo non sɪ opːorɾɛbːe a fare ʊn po dɪ affarɪ a bɔrdo./",A2,Grammar,"A2,Grammar",
injure,ferire,/ferire/,May I not injure any little creatures on unclear ground.,Che io non ferisca nessuna creaturina su un terreno poco chiaro.,/ke io non feriska nessʊna kreatʊrina sʊ ʊn terɾeno pɔko kjaro./,A2,Health,"A2,Health",
injury,infortunio,/infortunio/,It is our safeguard against injury.,È la nostra salvaguardia contro gli infortuni.,/e la nɔstra salvaɡwardia kontro ʎɪ infortunɪ./,A2,Health,"A2,Health",
inner,interno,/intɛrno/,"Rather, the focus is on the inner qualities of freedom.",L'attenzione si concentra piuttosto sulle qualità interiori della libertà.,/latːentsione sɪ kontʃentra pjʊtːɔsto sʊlle kwalita interiorɪ della liberta./,A2,Grammar,"A2,Grammar",
insect,insetto,/insɛtːo/,The three classes of insects are: 1.,Le tre classi di insetti sono: 1.,/le tre klassɪ dɪ insɛtːɪ sono: uno./,A2,Social,"A2,Social",
inspiration,ispirazione,/ispiratsione/,Unless it be by inspiration.,A meno che non sia per ispirazione.,/a meno ke non sia per ispiratsione./,A2,Grammar,"A2,Grammar",
instant,istantaneo,/istantaneo/,Issue was joined in an instant.,La questione si è unita in un istante.,/la kwestjone sɪ e ʊnita in ʊn istante./,A2,Time & Quantity,"A2,Time & Quantity",
instead,invece,/invetʃe/,You should do it instead.,Dovreste invece farlo voi.,/dovreste invetʃe farlo voi./,A2,Grammar,"A2,Grammar",
instruction,istruzione,/istrʊtsione/,"They’re accepting, and take instruction respectfully.",Sono accettanti e accettano le istruzioni con rispetto.,/sono atʃːetːantɪ e atʃːetːano le istrʊtsionɪ kon rispɛtːo./,A2,Social,"A2,Social",
instructor,istruttore,/istrʊtːore/,Through how many qualities is one an instructor of the nuns?,Per quante qualità si è istruttori delle monache?,/per kwante kwalita sɪ e istrʊtːorɪ delle monake?/,A2,Social,"A2,Social",
instrument,strumento,/strʊmento/,"Here it is, a perfect instrument!","Eccolo qui, uno strumento perfetto!","/ɛkːolo kwi, uno strʊmento perfɛtːo!/",A2,Social,"A2,Social",
intelligence,intelligenza,/intellidʒɛntsa/,Have you gathered any intelligence?,Avete raccolto informazioni?,/avete rakːɔlto informatsionɪ?/,A2,Social,"A2,Social",
intelligent,intelligente,/intellidʒɛnte/,My intelligent sister is about where she was.,La mia intelligente sorella è più o meno come era lei.,/la mia intellidʒɛnte sorɛlla e pjʊ o meno kome ɛra lɛi./,A2,Grammar,"A2,Grammar",
international,internazionale,/internatsionale/,Many international visitors have come to visit.,Molti visitatori internazionali sono venuti a trovarci.,/moltɪ vizitatorɪ internatsionalɪ sono venutɪ a trovartʃɪ./,A2,Grammar,"A2,Grammar",
introduction,introduzione,/introdʊtsione/,So who is my Introduction for?,A chi è rivolta la mia Introduzione?,/a kɪ e rivɔlta la mia introdʊtsione?/,A2,Social,"A2,Social",
invade,invadere,/invadere/,King Ajātasattu wants to invade the Vajjis.,Il re Ajātasattu vuole invadere i Vajji.,/il rɛ ajatazatːʊ vʊɔle invadere i vadʒdʒɪ./,A2,Travel,"A2,Travel",
invent,inventare,/inventare/,I could well wish courtesy would invent some other custom of entertainment.,Potrei desiderare che la cortesia inventasse qualche altra usanza di intrattenimento.,/potrɛi deziderare ke la kortezia inventasse kwalke altra ʊzantsa dɪ intratːenimento./,A2,Food,"A2,Food",
invention,invenzione,/inventsione/,Necessity is the mother of invention.,La necessità è la madre dell'invenzione.,/la netʃessita e la madre dellinventsione./,A2,Grammar,"A2,Grammar",
invitation,invito,/invito/,Today is the invitation ceremony.,Oggi si svolge la cerimonia di invito.,/ɔdʒːɪ sɪ zvoldʒe la tʃerimɔnia dɪ invito./,A2,Social,"A2,Social",
invite,invito,/invito/,We might as well invite him.,Tanto vale invitarlo.,/tanto vale invitarlo./,A2,Social,"A2,Social",
involve,coinvolgere,/koinvoldʒere/,Shall I involve my friend in transportation--possibly for life!,"Dovrei coinvolgere il mio amico nel trasporto, forse per tutta la vita!","/dovrɛi koinvoldʒere il mio amiko nel traspɔrto, forse per tutːa la vita!/",A2,Social,"A2,Social",
issue,questione,/kwestjone/,The real issue was Spain.,Il vero problema era la Spagna.,/il vero problɛma ɛra la spaɲɲa./,A2,Social,"A2,Social",
itself,stesso,/stesso/,That of itself was hopeful.,Questo è di per sé motivo di speranza.,/kwesto ɛ dɪ per se motivo dɪ sperantsa./,A2,,A2,
jam,marmellata,/marmellata/,"(What is it, Minnie dear—jam?","(Cosa c'è, Minnie dear-jam?","/(kɔza tʃɛː, minnje deardʒam?/",A2,Food,"A2,Food",
jazz,jazz,/(en)dʒaz(it)/,"The piece is known, ” he concluded lustily, “as ‘Vladmir Tostoff’s Jazz History of the World!","L'opera è nota"", ha concluso con entusiasmo, ""come 'La storia del mondo del jazz di Vladmir Tostoff!","/lɔpera e nɔta"", a konkluzo kon entʊzjazmo, ""kome la stɔria del mondo del (en)dʒaz(it) dɪ vladmir tɔstoff!/",A2,Social,"A2,Social",
jelly,gelatina,/dʒelatina/,Pectose Substances are jelly-like bodies found in fruits and vegetables.,Le sostanze pectose sono corpi gelatinosi presenti nella frutta e nella verdura.,/le sostantse pektoze sono kɔrpɪ dʒelatinɔzɪ prezɛntɪ nella frutːa e nella verdura./,A2,Food,"A2,Food",
jewellery,gioielli,/dʒoiɛllɪ/,"People complained and criticized them, “How can nuns wear jewellery?","La gente si lamentava e le criticava: ""Come possono le suore indossare gioielli?","/la dʒɛnte sɪ lamentava e le kritikava: ""kome pɔssono le sʊore indossare dʒoiɛllɪ?/",A2,Shopping,"A2,Shopping",
joke,scherzo,/skertso/,Meg will relish that joke.,Meg apprezzerà questa battuta.,/mɛɡ apːretsːeɾa kwesta batːuta./,A2,Social,"A2,Social",
journalist,giornalista,/dʒornalista/,Then our journalist conceived and gave a handsome domino ball.,Poi il nostro giornalista ha concepito e dato una bella palla di domino.,/pɔi il nɔstro dʒornalista a kontʃepito e dato ʊna bɛlla palla dɪ dɔmino./,A2,Social,"A2,Social",
joy,gioia,/dʒɔia/,Do I feel joy again?,Provo di nuovo gioia?,/prɔvo dɪ nʊɔvo dʒɔia?/,A2,Grammar,"A2,Grammar",
junior,junior,/junior/,"I do, indeed, ’ replied the junior.","Certo che sì"", rispose il giovane.","/tʃɛrto ke siː"", rispoze il dʒovane./",A2,Social,"A2,Social",
junk,spazzatura,/spatsːatura/,This computer is a piece of junk.,Questo computer è un rottame.,/kwesto kompjuter e ʊn rotːame./,A2,Shopping,"A2,Shopping",
killer,assassino,/assassino/,The Killer is never hunted.,L'assassino non viene mai cacciato.,/lassassino non vjɛne maj katʃːato./,A2,Social,"A2,Social",
kilo,chilo,/kilo/,How heavy are you in kilos?,Quanto pesa in chili?,/kwanto peza in kilɪ?/,A2,Time & Quantity,"A2,Time & Quantity",
kilogram,chilogrammo,/kiloɡrammo/,I have put on two kilograms this summer.,Quest'estate ho messo su due chili.,/kwestestate o messo sʊ due kilɪ./,A2,Time & Quantity,"A2,Time & Quantity",
kilometer,chilometro,/kilometro/,These places are about twenty kilometers apart.,Questi luoghi distano circa venti chilometri l'uno dall'altro.,/kwestɪ lʊɔɡɪ distano tʃirka vɛntɪ kilometrɪ luno dallaltro./,A2,Time & Quantity,"A2,Time & Quantity",
kindly,gentilmente,/dʒentilmente/,"You are kindly met, sir.","La saluto cordialmente, signore.","/la saluto kordjalmente, siɲore./",A2,Grammar,"A2,Grammar",
kingdom,regno,/reɲɲo/,We have kissed away Kingdoms and provinces.,Abbiamo baciato via regni e province.,/abːjamo batʃato via reɲɲɪ e provintʃe./,A2,Professional,"A2,Professional",
kit,kit,/kit/,"More pity that the eagles should be mewed, Whiles kites and buzzards prey at liberty.","Più che altro è un peccato che le aquile debbano miagolare, mentre nibbi e poiane predano in libertà.","/pjʊ ke altro e ʊn pekːato ke le akwile debːano mjaɡolare, mentre nibːɪ e poiane predano in liberta./",A2,Shopping,"A2,Shopping",
knock,bussare,/bʊssare/,"Go to the gate, somebody knocks.","Vai al cancello, qualcuno bussa.","/vaj al kantʃɛllo, kwalkuno bussa./",A2,Grammar,"A2,Grammar",
knowledge,conoscenza,/konoʃɛntsa/,This is the ultimate knowledge.,Questa è la conoscenza definitiva.,/kwesta ɛ la konoʃɛntsa definitiva./,A2,Food,"A2,Food",
lab,laboratorio,/laboratɔrio/,Ziri has a black Lab.,Ziri ha un Lab nero.,/dzirɪ a ʊn lab nero./,A2,Shopping,"A2,Shopping",
labor,lavoro,/lavɔro/,Was he weary of his labors?,Era stanco delle sue fatiche?,/ɛra stanko delle sʊe fatike?/,A2,Professional,"A2,Professional",
lack,mancanza,/mankantsa/,Do you lack sexual organs?,Vi mancano gli organi sessuali?,/vɪ mankano ʎɪ ɔrɡanɪ sessʊalɪ?/,A2,Health,"A2,Health",
lake,lago,/laɡo/,These are the four lakes.,Questi sono i quattro laghi.,/kwestɪ sono i kwatːro laɡɪ./,A2,Home,"A2,Home",
lamp,lampada,/lampada/,These are the four lamps.,Queste sono le quattro lampade.,/kweste sono le kwatːro lampade./,A2,Shopping,"A2,Shopping",
landscape,paesaggio,/paezadʒːo/,The landscape was misty and vague.,Il paesaggio era nebbioso e vago.,/il paezadʒːo ɛra nebːjozo e vaɡo./,A2,Food,"A2,Food",
lane,corsia,/korsia/,"You know Krook, the Chancellor, across the lane.","Conoscete Krook, il Cancelliere, dall'altra parte della strada.","/konoʃete krɔok, il kantʃelliɛre, dallaltra parte della strada./",A2,Shopping,"A2,Shopping",
laptop,portatile,/portatile/,My laptop doesn't have an optical disk drive.,Il mio portatile non ha un'unità disco ottico.,/il mio portatile non a ʊnʊnita disko ɔtːiko./,A2,Shopping,"A2,Shopping",
last,ultimo,/ultimo/,He was here last night.,È stato qui ieri sera.,/e stato kwi jɛrɪ sera./,A2,Social,"A2,Social",
latest,ultimo,/ultimo/,His latest fancy was that he was God.,La sua ultima fantasia era quella di essere Dio.,/la sʊa ultima fantazia ɛra kwella dɪ ɛssere dio./,A2,Social,"A2,Social",
latter,quest'ultimo,/kwestultimo/,The latter’s work was expeditious.,Il lavoro di quest'ultimo è stato rapido.,/il lavɔro dɪ kwestultimo e stato rapido./,A2,Social,"A2,Social",
laughter,risate,/rizate/,I was ready to die of laughter.,Ero pronto a morire dalle risate.,/ɛro pronto a morire dalle rizate./,A2,Social,"A2,Social",
law,legge,/ledʒːe/,Must I rob the law?,Devo derubare la legge?,/dɛvo derʊbare la ledʒːe?/,A2,Social,"A2,Social",
lawyer,avvocato,/avvokato/,You won’t have a lawyer?,Non avrà un avvocato?,/non avra ʊn avvokato?/,A2,Social,"A2,Social",
laziness,pigrizia,/piɡritsia/,Laziness is the stain of beauty.,La pigrizia è la macchia della bellezza.,/la piɡritsia e la makːia della belletsːa./,A2,Abstract,"A2,Abstract",
lead,piombo,/pjɔmbo/,You should lead this community.,Dovreste essere voi a guidare questa comunità.,/dovreste ɛssere voi a ɡwidare kwesta komʊnita./,A2,Social,"A2,Social",
learner,apprendista,/apːrendista/,"After seven years, Jīvaka thought, “I’m a good learner, and I’ve been studying for seven years.","Dopo sette anni, Jīvaka pensò: ""Sono un buon allievo e ho studiato per sette anni.","/dopo sɛtːe annɪ, dʒivaka pensɔ: ""sono ʊn bwɔn alliɛvo e o stʊdjato per sɛtːe annɪ./",A2,Social,"A2,Social",
learning,apprendimento,/apːrendimento/,You are learning something every day.,Ogni giorno imparate qualcosa.,/oɲɲɪ dʒorno impaɾate kwalkɔza./,A2,Grammar,"A2,Grammar",
least,meno,/meno/,I have spoke the least.,Ho parlato il meno possibile.,/o parlato il meno possibile./,A2,Grammar,"A2,Grammar",
leather,pelle,/pɛlle/,It is generally faced with leather.,In genere è rivestito in pelle.,/in dʒɛnere e rivestito in pɛlle./,A2,Activities,"A2,Activities",
lecture,lezione,/letsione/,Must he in thee read lectures of such shame?,Deve forse leggere in te lezioni di tale vergogna?,/dɛve forse lɛdʒːere in te letsionɪ dɪ tale verɡoɲɲa?/,A2,Social,"A2,Social",
