English_Term,Italian_Translation,Italian_IPA,English_Sentence,Italian_Sentence_Translation,Italian_Sentence_IPA,CEFR_Level,Taxonomy,Tags,Notes
worker,lavoratore,/lavoratore/,Do you need a monastery worker?,Avete bisogno di un lavoratore del monastero?,/avete bizoɲɲo dɪ ʊn lavoratore del monastɛro?/,A1,Social,"A1,Social",
writer,scrittore,/skritːore/,The original writers are silent.,Gli autori originali tacciono.,/ʎɪ aʊtorɪ oridʒinalɪ tatʃːono./,A1,Social,"A1,Social",
writing,scrittura,/skritːura/,I thought I knew the writing.,Pensavo di conoscere la scrittura.,/pensavo dɪ konoʃere la skritːura./,A1,Social,"A1,Social",
yes,sì,/siː/,Yes--she is a clever girl.,"Sì, è una ragazza intelligente.","/siː, e ʊna raɡatsːa intellidʒɛnte./",A1,Social,"A1,Social",
young,giovane,/dʒovane/,This is the young gentleman.,Questo è il giovane signore.,/kwesto ɛ il dʒovane siɲore./,A1,Social,"A1,Social",
