"Question","Answer","Tags"
"How do you say hello and goodbye in Italian?","Ciao, Buongiorno, Arrivederci, Buonanotte.","A1-Grammar-Practical_Communication-Rules"
"How do you tell someone your name or introduce another person?","Mi chiamo...; Ti presento...; Le presento...","A1-Grammar-Practical_Communication-Rules"
"How do you ask and answer about name, nationality, age, job, or address?","Come ti chiami? Sono... Ho ... anni. Faccio il/la... Abito a...","A1-Grammar-Practical_Communication-Rules"
"How do you politely ask for something in Italian?","Potrei avere...? Mi può dire...? Vorrei...","A1-Grammar-Practical_Communication-Rules"
"How do you ask and give directions?","Dov'è...? Vai dritto. Giri a sinistra/destra.","A1-Grammar-Practical_Communication-Rules"
"What do you say when buying or ordering food/drinks?","Quanto costa? Vorrei... Il conto, per favore.","A1-Grammar-Practical_Communication-Rules"
"How do you make plans, agree, or refuse politely?","Va bene. Mi dispiace. Possiamo...","A1-Grammar-Practical_Communication-Rules"
"How do you talk about what you like or dislike?","Mi piace... / Non mi piacciono...","A1-Grammar-Practical_Communication-Rules"
"What do you say in emergencies or urgent situations?","Aiuto! Mi sono perso. Dove si trova il bagno?","A1-Grammar-Practical_Communication-Rules"