English_Translation,Italian_Term,Italian_IPA,English_Sentence,Italian_Sentence,Italian_Sentence_IPA,CEFR_Level,Taxonomy,Tags,Notes
sceptical,scettico,/ʃɛtːiko/,She can't help but be sceptical of him.,Non può fare a meno di essere scettica nei suoi confronti.,/non pʊɔ fare a meno dɪ ɛssere ʃɛtːika nei sʊɔi konfrontɪ./,C2,Grammar,"C2,Grammar",
scornful,sprezzante,/spretsːante/,"So when someone makes a valid criticism, they’re scornful and admit nothing.","Così, quando qualcuno muove una critica valida, si mostra sprezzante e non ammette nulla.","/kozi, kwando kwalkuno mʊove ʊna kritika valida, sɪ mostra spretsːante e non ammetːe nulla./",C2,Grammar,"C2,Grammar",
scornfully,sprezzantemente,/spretsːantemente/,"You are facetious, sir, ’ said Nicholas, scornfully.","Lei è un po' faceto, signore"", disse Nicholas, sprezzante.","/lɛi e ʊn po fatʃɛto, siɲore"", disse nikolas, spretsːante./",C2,Grammar,"C2,Grammar",
sedate,sedare,/sedare/,Sedate and solemn were the score of rubbers in which Mr.,Seducente e solenne è stata la ventina di gommini in cui Mr.,/sedʊtʃɛnte e solɛnne e stata la ventina dɪ ɡomminɪ in kuj ɛmmeɛrɾe./,C2,Grammar,"C2,Grammar",
sedately,con calma,/kon kalma/,"Mrs. Sparsit sedately resumed her work and occasionally gave a small cough, which sounded like the cough of conscious strength and forbearance.","La signora Sparsit riprese con calma il suo lavoro e di tanto in tanto emetteva un piccolo colpo di tosse, che sembrava la tosse della forza e della tolleranza consapevole.","/la siɲora sparsit ripreze kon kalma il sʊo lavɔro e dɪ tanto in tanto emetːɛva ʊn pikːolo kolpo dɪ tosse, ke sembrava la tosse della fɔrtsa e della tollerantsa konsapevole./",C2,Grammar,"C2,Grammar",
sedentary,sedentario,/sedentario/,Ziri was a sedentary person.,Ziri era una persona sedentaria.,/dzirɪ ɛra ʊna persona sedentaria./,C2,Grammar,"C2,Grammar",
seemingly,apparentemente,/apːarentemente/,He is now seemingly quiet for a spell....,Ora è apparentemente silenzioso per un incantesimo....,/ora e apːarentemente silentsjozo per ʊn inkantezimo..../,C2,Grammar,"C2,Grammar",
selective,selettivo,/seletːivo/,"| The idiom tatratatra (literally “there, there”) is not selective (“here and there”) but distributive (“everywhere”).","| L'idioma tatratatra (letteralmente ""lì, là"") non è selettivo (""qui e là"") ma distributivo (""ovunque"").","/lidjɔma tatratatra (letːeralmente ""li, la"") non e seletːivo (""kwi e la"") ma distribʊtivo (""ovunkwe"")./",C2,Grammar,"C2,Grammar",
self-conscious,autocosciente,/aʊtokoʃɛnte/,"Whenever I'm at the pizza parlour, I make you self-conscious.","Ogni volta che sono in pizzeria, ti faccio sentire in imbarazzo.","/oɲɲɪ vɔlta ke sono in pitsːeria, tɪ fatʃːo sentire in imbaɾatsːo./",C2,Grammar,"C2,Grammar",
sensitivity,sensibilità,/sensibilita/,"The sensitivity certainly drops if I use a condom, so if possible I'd like to do it bareback.","La sensibilità diminuisce sicuramente se uso il preservativo, quindi se possibile vorrei farlo a pelo.","/la sensibilita diminʊiʃe sikʊramente se uzo il prezervativo, kwindɪ se possibile vorɾɛi farlo a pelo./",C2,Grammar,"C2,Grammar",
sentient,senziente,/sentsiɛnte/,A sentient being enters transmigration.,Un essere senziente entra in trasmigrazione.,/ʊn ɛssere sentsiɛnte entra in trazmiɡratsione./,C2,Grammar,"C2,Grammar",
sentiment,sentimento,/sentimento/,"I have no softness there, no—sympathy—sentiment—nonsense.","Non c'è morbidezza, non c'è simpatia, non c'è sentimento.","/non tʃe morbidetsːa, non tʃe simpatia, non tʃe sentimento./",C2,Grammar,"C2,Grammar",
sentimental,sentimentale,/sentimentale/,This is one of his sentimental days.,Questo è uno dei suoi giorni sentimentali.,/kwesto ɛ uno deɪ sʊɔi dʒornɪ sentimentalɪ./,C2,Grammar,"C2,Grammar",
sentimentally,sentimentalmente,/sentimentalmente/,We talked about the sentimentally last night.,Ieri sera abbiamo parlato del sentimento.,/jɛrɪ sera abːjamo parlato del sentimento./,C2,Grammar,"C2,Grammar",
showy,vistoso,/vistozo/,You are a showy person.,Lei è una persona appariscente.,/lɛi e ʊna persona apːariʃɛnte./,C2,Grammar,"C2,Grammar",
simulation,simulazione,/simʊlatsione/,Are we living in a computer simulation?,Viviamo in una simulazione al computer?,/vivjamo in ʊna simʊlatsione al kompjuter?/,C2,Grammar,"C2,Grammar",
situated,situato,/sitʊato/,You are very pleasantly situated here!,Qui vi trovate in una posizione molto piacevole!,/kwi vɪ trovate in ʊna pozitsione molto pjatʃevole!/,C2,Grammar,"C2,Grammar",
slack,allentamento,/allentamento/,"Alack that Leonine was so slack, so slow!","Peccato che Leonine sia stata così lenta, così lenta!","/pekːato ke leonine sia stata kozi lɛnta, kozi lɛnta!/",C2,Grammar,"C2,Grammar",
slackly,allentatamente,/allentatamente/,"That a king’s children should be so convey’d, So slackly guarded, and the search so slow That could not trace them!","Che i figli di un re siano così trasportati, così poco sorvegliati, e che le ricerche siano così lente da non poterli rintracciare!","/ke i fiʎɪ dɪ ʊn rɛ siːano kozi trasportatɪ, kozi pɔko sorveʎatɪ, e ke le ritʃɛrke siːano kozi lɛnte da non potɛrlɪ rintratʃːare!/",C2,Grammar,"C2,Grammar",
smug,compiaciuto,/kompjatʃuto/,"I will die bravely, like a smug bridegroom.","Morirò con coraggio, come uno sposo compiaciuto.","/moriɾɔ kon koradʒːo, kome uno spozo kompjatʃuto./",C2,Grammar,"C2,Grammar",
smugly,compiaciuto,/kompjatʃuto/,James was staring at Amanda smugly.,James fissava Amanda compiaciuto.,/(en)dʒeɪmz(it) fissava amanda kompjatʃuto./,C2,Grammar,"C2,Grammar",
solely,solo,/solo/,If this is solely a question of self-interest with you—’ Mr.,"Se per lei è solo una questione di interesse personale..."".","/se per lɛi e solo ʊna kwestjone dɪ interɛsse personale...""./",C2,Grammar,"C2,Grammar",
somber,cupo,/kupo/,"Having said this, I advanced toward the opening of the somber gallery.","Detto questo, mi avviai verso l'apertura della cupa galleria.","/detːo kwesto, mɪ avviaj vɛrso lapertura della kupa ɡalleria./",C2,Grammar,"C2,Grammar",
somberly,cupamente,/kʊpamente/,Everyone mentioned the somberly at work.,Tutti hanno parlato della cupa al lavoro.,/tutːɪ anno parlato della kupa al lavɔro./,C2,Grammar,"C2,Grammar",
spacious,spazioso,/spatsjozo/,There were besides a few dark closets and a spacious cellar.,C'erano inoltre alcuni armadi scuri e una spaziosa cantina.,/tʃɛrano inoltre alkʊnɪ armadɪ skurɪ e ʊna spatsjɔza kantina./,C2,Grammar,"C2,Grammar",
specialised,specializzato,/spetʃalidzːato/,A server is a specialised computer.,Un server è un computer specializzato.,/ʊn sɛrver e ʊn kompjuter spetʃalidzːato./,C2,Grammar,"C2,Grammar",
specimen,campione,/kampjone/,You are a fair specimen of 'em.,Lei è un discreto esemplare.,/lɛi e ʊn diskreto ezemplare./,C2,Grammar,"C2,Grammar",
speculative,speculativo,/spekʊlativo/,"All this is, of course, speculative.","Tutto questo è, ovviamente, speculativo.","/tutːo kwesto ɛ, ovviamente, spekʊlativo./",C2,Grammar,"C2,Grammar",
spontaneous,spontaneo,/spontaneo/,And what is spontaneous reproduction?,E cos'è la riproduzione spontanea?,/e kozɛ la riprodʊtsione spontanea?/,C2,Grammar,"C2,Grammar",
spontaneously,spontaneamente,/spontaneamente/,"Throughout the suttas, we see poetry spontaneously improvised.","In tutti i sutta, vediamo poesie improvvisate spontaneamente.","/in tutːɪ i sutːa, vedjamo poezie improvvizate spontaneamente./",C2,Grammar,"C2,Grammar",
staccato,staccato,/stakːato/,"Retté's style is not in the least like Huysmans's. It is more fluent, swifter, and more staccato.","Lo stile di Retté non è affatto simile a quello di Huysmans. È più fluente, più rapido e più staccato.","/lo stile dɪ retːe non e affatːo simile a kwello dɪ ʊizmans. e pjʊ flʊɛnte, pjʊ rapido e pjʊ stakːato./",C2,Grammar,"C2,Grammar",
staggering,sbalorditivo,/zbalorditivo/,"Doctor d’Avrigny,” said Barrois, staggering as if he would fall.","Dottore d'Avrigny"", disse Barrois, barcollando come se stesse per cadere.","/dotːore davriɲɲɪ"", disse barɾɔis, barkollando kome se stesse per kadere./",C2,Grammar,"C2,Grammar",
staple,graffetta,/ɡraffetːa/,Hence teachings very much like this are a staple in meditation communities.,Perciò insegnamenti molto simili a questo sono un punto fermo nelle comunità di meditazione.,/pertʃɔ inseɲamentɪ molto similɪ a kwesto sono ʊn punto fermo nelle komʊnita dɪ meditatsione./,C2,Grammar,"C2,Grammar",
stark,stellare,/stellare/,Better were I stark and stiff!,Meglio se fossi rigido e spoglio!,/mɛʎo se fɔssɪ ridʒido e spɔʎo!/,C2,Grammar,"C2,Grammar",
startling,sorprendente,/sorprendɛnte/,The details were few and startling.,I dettagli erano pochi e sorprendenti.,/i detːaʎɪ ɛrano pɔkɪ e sorprendɛntɪ./,C2,Grammar,"C2,Grammar",
startlingly,sorprendentemente,/sorprendentemente/,It was startlingly like the image conveyed to me in Dr.,Era sorprendentemente simile all'immagine che mi è stata trasmessa dal Dott.,/ɛra sorprendentemente simile allimmadʒine ke mɪ e stata trazmessa dal dɔtː./,C2,Grammar,"C2,Grammar",
stately,maestoso,/maestozo/,These stately rooms had neither windows nor chimneys.,Queste stanze signorili non avevano né finestre né camini.,/kweste stantse siɲorilɪ non avevano ne finɛstre ne kaminɪ./,C2,Grammar,"C2,Grammar",
statistical,statistica,/statistika/,"=Statistical Fallacies.=—If “fallacies” be regarded as synonymous with “errors,” clearly they may occur at every step.","=Se si considerano le ""fallacie"" come sinonimo di ""errori"", è chiaro che possono verificarsi a ogni passo.","/ʊɡwale se sɪ konsiderano le ""fallatʃe"" kome sinɔnimo di ""erɾorɪ"", e kjaro ke pɔssono verifikarsɪ a oɲɲɪ passo./",C2,Grammar,"C2,Grammar",
stimuli,stimoli,/stimolɪ/,They might not even respond as we do to the same stimuli.,Potrebbero anche non rispondere come noi agli stessi stimoli.,/potrebːero anke non rispondere kome noi aʎɪ stessɪ stimolɪ./,C2,Grammar,"C2,Grammar",
stimulus,stimolo,/stimolo/,"Competition allowed, stimulus would be given.","La concorrenza è ammessa, lo stimolo è dato.","/la konkorɾɛntsa e ammessa, lo stimolo e dato./",C2,Grammar,"C2,Grammar",
strapping,reggetta,/redʒːetːa/,I only suppose so. What else can a strapping chap of twenty-one mean with a fine wench of seventeen?,Lo suppongo soltanto. Cos'altro può significare un ragazzo robusto di ventuno anni con una bella ragazza di diciassette?,/lo sʊpːoŋɡo soltanto. kozaːltro pʊɔ siɲifikare ʊn raɡatsːo robusto dɪ ventuno annɪ kon ʊna bɛlla raɡatsːa dɪ ditʃassɛtːe?/,C2,Grammar,"C2,Grammar",
stray,randagio,/randadʒo/,But do not stray far into the wood.,Ma non allontanatevi dal bosco.,/ma non allontanatevɪ dal bɔsko./,C2,Grammar,"C2,Grammar",
structural,strutturale,/strʊtːʊrale/,"Sir Harry hinted that a column, if possible, should be structural as well as decorative.","Sir Harry ha accennato al fatto che una colonna, se possibile, dovrebbe essere strutturale oltre che decorativa.","/sir hɛːrɾɪ a atʃːennato al fatːo ke ʊna kolonna, se possibile, dovrɛbːe ɛssere strʊtːʊrale oltre ke dekorativa./",C2,Grammar,"C2,Grammar",
structurally,strutturalmente,/strʊtːʊralmente/,The building is structurally unsound.,L'edificio non è strutturalmente solido.,/ledifitʃo non e strʊtːʊralmente sɔlido./,C2,Grammar,"C2,Grammar",
stuffily,in modo soffocante,/in mɔdo soffokante/,She researched the stuffily for her project.,Per il suo progetto ha fatto delle ricerche sull'impagliatura.,/per il sʊo prodʒɛtːo a fatːo delle ritʃɛrke sʊllimpaʎatura./,C2,Grammar,"C2,Grammar",
stuffy,soffocante,/soffokante/,Lucy complained that the hood was stuffy.,Lucy si è lamentata che la cappa era soffocante.,/lusɪ sɪ e lamentata ke la kapːa ɛra soffokante./,C2,Grammar,"C2,Grammar",
stylistic,stilistico,/stilistiko/,This is for stylistic reasons.,Questo per motivi stilistici.,/kwesto per motivɪ stilistitʃɪ./,C2,Grammar,"C2,Grammar",
stylistically,stilisticamente,/stilistikamente/,Hindu and Nazi swastikas are stylistically distinct.,Le svastiche indù e naziste sono stilisticamente distinte.,/le zvastike indu e natsiste sono stilistikamente distinte./,C2,Grammar,"C2,Grammar",
substantially,sostanzialmente,/sostantsjalmente/,I believe this to be substantially correct.,Ritengo che ciò sia sostanzialmente corretto.,/riteŋɡo ke tʃɔ sia sostantsjalmente korɾɛtːo./,C2,Grammar,"C2,Grammar",
subtly,sottilmente,/sotːilmente/,That’s how subtly Vepacitti was bound.,Ecco come è stata legata sottilmente la Vepacitti.,/ɛkːo kome e stata leɡata sotːilmente la vepatʃitːɪ./,C2,Grammar,"C2,Grammar",
suburban,suburbano,/sʊbʊrbano/,You forget the place is growing half suburban.,Si dimentica che il posto sta crescendo per metà in periferia.,/sɪ dimentika ke il posto sta kreʃɛndo per meta in periferia./,C2,Grammar,"C2,Grammar",
succulent,succulento,/sʊkːʊlɛnto/,Benedito's plant is a succulent.,La pianta di Benedito è una succulenta.,/la pjanta dɪ benedito e ʊna sʊkːʊlɛnta./,C2,Grammar,"C2,Grammar",
superficial,superficiale,/sʊperfitʃale/,None but the superficial would be shocked at her.,"Nessuno, se non i superficiali, si scandalizzerebbe di lei.","/nessuno, se non i sʊperfitʃalɪ, sɪ skandalidzːerɛbːe dɪ lɛi./",C2,Grammar,"C2,Grammar",
superficially,superficialmente,/sʊperfitʃalmente/,Yet the subject is superficially treated from the Persian and Arabian writers.,Eppure l'argomento è trattato in modo superficiale dagli scrittori persiani e arabi.,/epːure larɡomento e tratːato in mɔdo sʊperfitʃale daʎɪ skritːorɪ persjanɪ e aɾabɪ./,C2,Grammar,"C2,Grammar",
supple,flessibile,/flessibile/,"I will knead him, I’ll make him supple.","Lo impasterò, lo renderò elastico.","/lo impasteɾɔ, lo rendeɾɔ elastiko./",C2,Grammar,"C2,Grammar",
supreme,supremo,/sʊprɛmo/,This is the supreme happiness.,Questa è la felicità suprema.,/kwesta ɛ la felitʃita sʊprɛma./,C2,Grammar,"C2,Grammar",
surgical,chirurgico,/kirurdʒiko/,Damiano grabbed a surgical knife and went to Rima’s room.,Damiano prende un coltello chirurgico e va nella stanza di Rima.,/damjano prɛnde ʊn koltɛllo kirurdʒiko e va nella stantsa dɪ rima./,C2,Grammar,"C2,Grammar",
surplus,eccedenza,/etʃːedɛntsa/,There was enough economic surplus to support a large class of spiritual seekers.,C'era un surplus economico sufficiente a sostenere una grande classe di ricercatori spirituali.,/tʃɛra ʊn sʊrplus ekonɔmiko sʊffitʃɛnte a sostenɛre ʊna ɡrande klasse dɪ ritʃerkatorɪ spiritʊalɪ./,C2,Grammar,"C2,Grammar",
symptomatic,sintomatico,/sintomatiko/,Not everyone with the virus is symptomatic.,Non tutti i soggetti affetti dal virus sono sintomatici.,/non tutːɪ i sodʒːetːɪ affɛtːɪ dal virʊs sono sintomatitʃɪ./,C2,Grammar,"C2,Grammar",
synthesis,sintesi,/sintezɪ/,Perhaps Sāriputta was demonstrating his talent for creative rephrasing and synthesis.,Forse Sāriputta stava dimostrando il suo talento per la riformulazione e la sintesi creativa.,/forse sariputːa stava dimostrando il sʊo talɛnto per la riformʊlatsione e la sintezɪ kreativa./,C2,Grammar,"C2,Grammar",
synthetic,sintetico,/sintɛtiko/,Are those synthetic or cultured pearls?,Sono perle sintetiche o coltivate?,/sono pɛrle sintɛtike o koltivate?/,C2,Grammar,"C2,Grammar",
synthetically,sinteticamente,/sintetikamente/,It has also been formed synthetically.,È stata anche formata sinteticamente.,/e stata anke formata sintetikamente./,C2,Grammar,"C2,Grammar",
tactful,tattile,/tatːile/,Even the most tactful politician cannot have their foot in both camps for long.,Anche il politico più accorto non può stare a lungo in entrambi i campi.,/anke il politiko pjʊ akːɔrto non pʊɔ stare a luŋɡo in entrambɪ i kampɪ./,C2,Grammar,"C2,Grammar",
tactfully,con tatto,/kon tatːo/,Please put the tactfully on the table.,"Per favore, mettete il tatto sul tavolo.","/per favore, metːete il tatːo sʊl tavolo./",C2,Grammar,"C2,Grammar",
tactic,tattica,/tatːika/,47 The tactics of the Greeks and Macedonians were formed on very different principles.,47 Le tattiche dei Greci e dei Macedoni si basavano su principi molto diversi.,/kʊaɾaːntasɛtːe le tatːike deɪ ɡrɛtʃɪ e deɪ matʃedonɪ sɪ bazavano sʊ printʃipɪ molto divɛrsɪ./,C2,Grammar,"C2,Grammar",
tactical,tattico,/tatːiko/,A tactical retreat is sometimes interpreted as cowardice.,Una ritirata tattica viene talvolta interpretata come codardia.,/ʊna ritirata tatːika vjɛne talvɔlta interpretata kome kodardia./,C2,Grammar,"C2,Grammar",
tangle,groviglio,/ɡroviʎo/,"I ask you this, Gotama: who can untangle this tangle?","Ti chiedo questo, Gotama: chi può districare questo groviglio?","/tɪ kjedo kwesto, ɡotama: kɪ pʊɔ distrikare kwesto ɡroviʎo?/",C2,Grammar,"C2,Grammar",
tangled,aggrovigliato,/aɡːroviʎato/,"His speech was like a tangled chain; nothing impaired, but all disordered.","Il suo discorso era come una catena ingarbugliata: nulla di compromesso, ma tutto disordinato.","/il sʊo diskorso ɛra kome ʊna katena iŋɡarbʊʎata: nulla dɪ kompromesso, ma tutːo dizordinato./",C2,Grammar,"C2,Grammar",
tantamount,tantomount,/tantomoʊnt/,"Is that tantamount, sir, to acceptance, or rejection, or consideration?","Questo equivale, signore, all'accettazione, al rifiuto o alla considerazione?","/kwesto ekwivale, siɲore, allatʃːetːatsione, al rifjuto o alla konsideratsione?/",C2,Grammar,"C2,Grammar",
taut,teso,/tezo/,The hairs on the violin bow should not be too taut.,I crini dell'arco del violino non devono essere troppo tesi.,/i krinɪ dellarko del vjolino non devono ɛssere trɔpːo tɛzɪ./,C2,Grammar,"C2,Grammar",
tautly,tesa,/teza/,Everyone mentioned the tautly at work.,Tutti hanno parlato della tensione al lavoro.,/tutːɪ anno parlato della tensjone al lavɔro./,C2,Grammar,"C2,Grammar",
tedious,noioso,/noiozo/,"Speak on, but be not over-tedious.","Parlate pure, ma non siate troppo noiosi.","/parlate pure, ma non sjate trɔpːo noiɔzɪ./",C2,Grammar,"C2,Grammar",
tediously,noiosamente,/noiozamente/,Please put the tediously on the table.,"Per favore, mettete in tavola il tedioso.","/per favore, metːete in tavola il tedjozo./",C2,Grammar,"C2,Grammar",
temperamental,temperamento,/temperamento/,The Sakyans are indeed temperamental.,I Sakyan sono davvero irascibili.,/i sakjan sono davvero iraʃibilɪ./,C2,Grammar,"C2,Grammar",
temperamentally,temperamentalmente,/temperamentalmente/,He explained the temperamentally during the meeting.,Ha spiegato il temperamento durante l'incontro.,/a spjeɡato il temperamento dʊrante linkontro./,C2,Grammar,"C2,Grammar",
texture,struttura,/strʊtːura/,"When fresh, it is of uniform creamy color, moist, and of a firm, even texture[18].","Quando è fresco, è di colore crema uniforme, umido e di consistenza soda e uniforme[18].","/kwando e fresko, e dɪ kolore krɛma ʊniforme, umido e dɪ konsistɛntsa sɔda e ʊniforme[ditʃɔtːo]./",C2,Grammar,"C2,Grammar",
thankfully,fortunatamente,/fortʊnatamente/,"We were just in time, ” said the Professor thankfully.","Siamo arrivati appena in tempo"", disse il professore con gratitudine.","/sjamo arɾivatɪ apːena in tɛmpo"", disse il professore kon ɡratitudine./",C2,Grammar,"C2,Grammar",
theology,teologia,/teolodʒia/,"Divested of theology, the experience of our senses is not “honey” but “fire”.","Spogliata della teologia, l'esperienza dei nostri sensi non è ""miele"" ma ""fuoco"".","/spoʎata della teolodʒia, lesperiɛntsa deɪ nɔstrɪ sɛnsɪ non ɛː ""mjɛle"" ma ""fʊɔko""./",C2,Grammar,"C2,Grammar",
theoretical,teorico,/teɔriko/,"All scientific teaching, theoretical and practical, shows it to be impossible.","Tutto l'insegnamento scientifico, teorico e pratico, lo dimostra come impossibile.","/tutːo linseɲamento ʃentifiko, teɔriko e pratiko, lo dimɔstra kome impossibile./",C2,Grammar,"C2,Grammar",
thereby,in tal modo,/in tal mɔdo/,Thereby have villainies been detected.,In questo modo sono state rilevate le scelleratezze.,/in kwesto mɔdo sono state rilevate le ʃelleratetsːe./,C2,Grammar,"C2,Grammar",
timid,timido,/timido/,Yet the effect is incongruous to the timid alone.,Eppure l'effetto è incongruo solo per i timidi.,/epːure leffɛtːo e inkoŋɡrʊo solo per i timidɪ./,C2,Grammar,"C2,Grammar",
tolerance,tolleranza,/tollerantsa/,There are these five benefits of tolerance.,I benefici della tolleranza sono cinque.,/i benefitʃɪ della tollerantsa sono tʃinkwe./,C2,Grammar,"C2,Grammar",
torturous,tortuoso,/tortʊozo/,The teacher discussed the torturous in class.,L'insegnante ha discusso la tortura in classe.,/linseɲante a diskusso la tortura in klasse./,C2,Grammar,"C2,Grammar",
tranquil,tranquillo,/trankwillo/,The country was apparently tranquil.,Il paese era apparentemente tranquillo.,/il paeze ɛra apːarentemente trankwillo./,C2,Grammar,"C2,Grammar",
transatlantic,transatlantico,/transatlantiko/,But transatlantic telephony is still a thing of the future.,Ma la telefonia transatlantica è ancora una cosa del futuro.,/ma la telefonia transatlantika e ankora ʊna kɔza del fʊturo./,C2,Grammar,"C2,Grammar",
traumatic,traumatico,/traʊmatiko/,Mary had a traumatic experience.,Mary ha vissuto un'esperienza traumatica.,/mɛːɾɪ a vissuto ʊnesperiɛntsa traʊmatika./,C2,Grammar,"C2,Grammar",
tribal,tribale,/tribale/,Judaism is a tribal religion.,L'ebraismo è una religione tribale.,/lebraiːzmo e ʊna relidʒone tribale./,C2,Grammar,"C2,Grammar",
troubled,travagliato,/travaʎato/,It was a troubled dream?,Era un sogno agitato?,/ɛra ʊn soɲɲo adʒitato?/,C2,Grammar,"C2,Grammar",
unassisted,non assistito,/non assistito/,"Come, come,” said Danglars to himself, “now the thing is at work and it will effect its purpose unassisted.","Su, su"", disse Danglars tra sé e sé, ""ora la cosa è all'opera e raggiungerà il suo scopo senza aiuti.","/su, su"", disse daŋɡlars tra se e se, ""ora la kɔza e allɔpera e radʒːʊndʒeɾa il sʊo skɔpo sɛntsa ajutɪ./",C2,Grammar,"C2,Grammar",
unconstitutional,incostituzionale,/inkostitʊtsionale/,He said it was unconstitutional.,Ha detto che è incostituzionale.,/a detːo ke e inkostitʊtsionale./,C2,Grammar,"C2,Grammar",
unconventional,non convenzionale,/non konventsionale/,The truth must be told; she is too unconventional for him.,Bisogna dire la verità: lei è troppo anticonvenzionale per lui.,/bizoɲɲa dire la verita: lɛi e trɔpːo antikonventsionale per lui./,C2,Grammar,"C2,Grammar",
unconvincing,poco convincente,/pɔko konvintʃɛnte/,"But this leaves padā unexplained, and the commentary’s gloss of bhaddālatā is unconvincing.","Ma questo lascia padā senza spiegazione, e la glossa del commento a bhaddālatā non è convincente.","/ma kwesto laʃa pada sɛntsa spjeɡatsione, e la ɡlɔssa del kommento a badːalata non e konvintʃɛnte./",C2,Grammar,"C2,Grammar",
unconvincingly,in modo poco convincente,/in mɔdo pɔko konvintʃɛnte/,"I can’t complain, ” answered Wilson unconvincingly.","Non posso lamentarmi"", rispose Wilson senza convinzione.","/non pɔsso lamentarmɪ"", rispoze wilson sɛntsa konvintsione./",C2,Grammar,"C2,Grammar",
undaunted,imperterrito,/impertɛrɾito/,"Why, you and me, sir, ” was the undaunted reply.","Ma io e lei, signore"", fu la risposta imperterrita.","/ma io e lɛi, siɲore"", fʊ la risposta impertɛrɾita./",C2,Grammar,"C2,Grammar",
underlying,sottostante,/sotːostante/,My underlying tendencies will be uprooted.,Le mie tendenze di fondo saranno sradicate.,/le mie tendɛntse dɪ fondo saɾanno zradikate./,C2,Grammar,"C2,Grammar",
unenviable,invidiabile,/invidjabile/,It was unenviable.,È stato poco invidiabile.,/e stato pɔko invidjabile./,C2,Grammar,"C2,Grammar",
uneventful,senza problemi,/sɛntsa problɛmɪ/,"I foresaw at Florence that her quiet, uneventful childhood must end, and it has ended.","A Firenze avevo previsto che la sua infanzia tranquilla e priva di eventi dovesse finire, e così è stato.","/a firɛntse avevo previsto ke la sʊa infantsia trankwilla e priva dɪ evɛntɪ dovɛsse finire, e kozi e stato./",C2,Grammar,"C2,Grammar",
uninspiring,poco stimolante,/pɔko stimolante/,"These verses on dark and bright, They are the same for the nuns; Being uninspiring, being inspiring, And so two others.","Questi versi sul buio e sulla luce, sono gli stessi per le monache; essere poco stimolanti, essere stimolanti, e così altri due.","/kwestɪ versɪ sʊl buːjo e sʊlla lutʃe, sono ʎɪ stessɪ per le monake; ɛssere pɔko stimolantɪ, ɛssere stimolantɪ, e kozi altrɪ due./",C2,Grammar,"C2,Grammar",
unmanageable,ingestibile,/indʒestibile/,He is an unmanageable child.,È un bambino ingestibile.,/e ʊn bambino indʒestibile./,C2,Grammar,"C2,Grammar",
unmanned,non presidiato,/non prezidjato/,"Here’s a man from Man; a man born in once independent Man, and now unmanned of Man; which is sucked in—by what?","Ecco un uomo proveniente dall'Uomo; un uomo nato nell'Uomo un tempo indipendente, e ora non più uomo dell'Uomo; che viene risucchiato da cosa?","/ɛkːo ʊn wɔmo proveniɛnte dallwɔmo; ʊn wɔmo nato nellwɔmo ʊn tɛmpo indipendɛnte, e ora non pjʊ wɔmo dellwɔmo; ke vjɛne rizʊkːjato da kɔza?/",C2,Grammar,"C2,Grammar",
unmusical,non musicale,/non mʊzikale/,Please put the unmusical on the table.,"Per favore, mettete sul tavolo il non-musicale.","/per favore, metːete sʊl tavolo il nonmʊzikale./",C2,Grammar,"C2,Grammar",
unmusically,non musicale,/non mʊzikale/,She researched the unmusically for her project.,Per il suo progetto ha fatto ricerche sull'unmusical.,/per il sʊo prodʒɛtːo a fatːo ritʃɛrke sʊllʊnmʊzikal./,C2,Grammar,"C2,Grammar",
